BTM,target,n,r,p_value
D3/0_CD1 and other DC receptors (M50),outcome,34,-0.5108110279705965,0.0020221330906925374
D7/0_enriched in B cells (II) (M47.1),outcome,34,0.5094012639921901,0.0020908279095469525
D3/0_enriched in neutrophils (I) (M37.1),outcome,34,-0.49916645702619883,0.002653553501635494
D3/0_Naive B cell surface signature (S8),outcome,34,0.4740705401373115,0.004620326043733016
D3/0_TBA (M102),outcome,34,0.4649600807685706,0.005594793147523161
D3/0_B cell surface signature (S2),outcome,34,0.45134564837630126,0.007377742712510641
D7/0_B cell surface signature (S2),outcome,34,0.4509429980365745,0.007437114885211557
D1/0_TBA (M131),outcome,34,-0.4506950362797102,0.007473880224885714
D3/0_suppression of MAPK signaling (M56),outcome,34,-0.44493207154983094,0.008373129643391647
D3/0_Memory B cell surface signature (S9),outcome,34,0.44313168952071086,0.00867228740804718
D3/0_recruitment of neutrophils (M132),outcome,34,-0.43648967177012704,0.009855861909056896
D3/0_leukocyte migration (M88.0),outcome,34,0.43224160851273336,0.010682499291859339
D3/0_enriched in antigen presentation (I) (M71),outcome,34,-0.4251581962889248,0.012191265258967517
"D3/0_collagen, TGFB family et al (M77)",outcome,34,0.42082871594526206,0.013199069753142577
D7/0_enriched in B cells (IV) (M47.3),outcome,34,0.41651259794882434,0.014272649126366261
D3/0_enriched in neutrophils (II) (M163),outcome,34,-0.41455024274770697,0.014784475637331063
D3/0_formyl peptide receptor mediated neutrophil response (M11.2),outcome,34,-0.4126932063624668,0.015282923941902733
D3/0_cell adhesion (lymphocyte homing) (M21),outcome,34,0.40894316866063474,0.016332483443896942
"D3/0_RA, WNT, CSF receptors network (monocyte) (M23)",outcome,34,-0.40874118441251367,0.016390683994472466
"D3/0_cell adhesion, membrane (M133.0)",outcome,34,0.40757908182770003,0.016728916312978542
D3/0_enriched in B cells (II) (M47.1),outcome,34,0.4065050082927117,0.017046694980727823
D3/0_MHC-TLR7-TLR8 cluster (M146),outcome,34,-0.40390392221802096,0.017837201556739825
D3/0_enriched for promoter motif NATCACGTGAY (putative SREBF1 targets) (M178),outcome,34,0.3992197578010997,0.019337888832429585
D7/0_CD1 and other DC receptors (M50),outcome,34,-0.39441329953620974,0.020985454837114635
"D1/0_myeloid cell cytokines, metallopeptidases and laminins (M78)",outcome,34,-0.39287175189426093,0.021537898273355904
D7/0_suppression of MAPK signaling (M56),outcome,34,-0.3925273978371886,0.021662936733198135
D7/0_Hox cluster VI (M107),outcome,34,0.39216340879773404,0.021795758093727
D3/0_TLR and inflammatory signaling (M16),outcome,34,-0.3900283884169764,0.022588489554065512
D3/0_TBA (M241),outcome,34,0.3856717128262492,0.02428022071832522
D7/0_enriched in B cells (VI) (M69),outcome,34,0.385647996301943,0.02428970832528037
D3/0_TBA (M198),outcome,34,-0.3853926471362173,0.024392052623685902
D3/0_enriched in B cells (I) (M47.0),outcome,34,0.38465645620848643,0.024689111970948165
D7/0_signaling in T cells (I) (M35.0),outcome,34,-0.3809096800243166,0.02624756130052252
D3/0_enriched in antigen presentation (II) (M95.0),outcome,34,-0.3807221289070611,0.02632765087992834
D7/0_targets of FOSL1/2 (M0),outcome,34,-0.37943712520576656,0.026881806536267767
D3/0_TLR8-BAFF network (M25),outcome,34,-0.37917501145502125,0.026996011462722784
D3/0_TBA (M55),outcome,34,-0.37779836985553344,0.027602389056387785
D3/0_glycerophospholipid metabolism (M114.1),outcome,34,-0.37734051291179294,0.02780652480586008
D3/0_Monocyte surface signature (S4),outcome,34,-0.37655940014857325,0.02815764363936702
D7/0_enriched for promoter motif NATCACGTGAY (putative SREBF1 targets) (M178),outcome,34,0.3764010787785348,0.028229252261118182
D3/0_enriched in B cells (VI) (M69),outcome,34,0.3747522035770426,0.028983954516533517
D7/0_enriched in B cells (I) (M47.0),outcome,34,0.37190895406646535,0.030324123549698684
D3/0_olfactory receptors (M228),outcome,34,0.3702173031251193,0.031145244814725272
"D3/0_lipid metabolism, endoplasmic reticulum (M92)",outcome,34,-0.36867824971882596,0.03190799007780325
D3/0_enriched in B cells (IV) (M47.3),outcome,34,0.36431750165899746,0.03415228072976909
D7/0_TBA (M208),outcome,34,0.36026242771419825,0.036352909451466166
D1/0_TBA (M249),outcome,34,-0.3600298219070676,0.0364825494245944
"D1/0_collagen, TGFB family et al (M77)",outcome,34,0.35931760484156045,0.0368818284851399
D3/0_TBA (M79),outcome,34,-0.3588989100081405,0.037118203478250754
D7/0_enriched in activated dendritic cells/monocytes (M64),outcome,34,-0.35694596739962675,0.038237013678831276
D7/0_enriched in naive and memory B cells (M83),outcome,34,0.35684041756492285,0.03829825038341792
D7/0_TBA (M198),outcome,34,-0.35600163143419816,0.038787714292802984
D3/0_enriched in monocytes (IV) (M118.0),outcome,34,-0.35424235851787494,0.03983075467925193
"D7/0_MAPK, RAS signaling (M100)",outcome,34,-0.350087868343526,0.04238394383233692
D3/0_mitotic cell cycle in stimulated CD4 T cells (M4.11),outcome,34,-0.349716821882023,0.04261824016277421
"D3/0_immuregulation - monocytes, T and B cells (M57)",outcome,34,0.3488756295629355,0.04315327087176994
D7/0_double positive thymocytes (M126),outcome,34,0.3473658746964018,0.04412707674686008
D7/0_TBA (M241),outcome,34,0.3437617395761339,0.04652326114548698
D7/0_enriched in antigen presentation (I) (M71),outcome,34,-0.3430760570586674,0.0469907206800928
D7/0_enriched in neutrophils (I) (M37.1),outcome,34,-0.3403494061847925,0.048886944089715216
D7/0_TBA (M102),outcome,34,0.34028647798701983,0.048931418021983815
"D3/0_plasma cells & B cells, immunoglobulins (M156.0)",outcome,34,0.3397524080518695,0.04931016998409435
D3/0_enriched in naive and memory B cells (M83),outcome,34,0.33968498163386823,0.049358153498571984
D3/0_cytoskeletal remodeling (enriched for SRF targets) (M34),outcome,34,0.3374547123751343,0.050966439897721885
D3/0_complement and other receptors in DCs (M40),outcome,34,-0.3335348951589466,0.05389410388421837
D3/0_enriched in B cells (III) (M47.2),outcome,34,0.3314624623524808,0.05549511146457791
D7/0_lymphocyte generic cluster (M60),outcome,34,0.3312472368502061,0.05566351815098633
D3/0_TBA (M48),outcome,34,-0.3283081135056599,0.058004090751096256
D7/0_Hox cluster V (M96),outcome,34,0.3280326593765412,0.058227379125788764
D7/0_enriched in NK cells (KIR cluster) (M61.1),outcome,34,-0.32679767413082816,0.059236851213713505
D1/0_cell junction (GO) (M4.13),outcome,34,-0.32667059692191425,0.059341503290462665
"D7/0_collagen, TGFB family et al (M77)",outcome,34,0.3250816181252551,0.06066244700603319
D7/0_cell cycle and growth arrest (M31),outcome,34,-0.32407895328576686,0.06150784294981978
D3/0_enriched in antigen presentation (III) (M95.1),outcome,34,-0.3217078277764538,0.06354401003617714
D7/0_chemokine cluster (I) (M27.0),outcome,34,-0.32122418332409514,0.06396576800210849
D7/0_chemokines and receptors (M38),outcome,34,-0.3211271719931078,0.06405063026766268
D3/0_lymphocyte generic cluster (M60),outcome,34,0.3209297982837599,0.06422355936930695
D1/0_mitotic cell cycle - DNA replication (M4.4),outcome,34,-0.3200060474631913,0.06503778716087494
D3/0_signaling in T cells (II) (M35.1),outcome,34,-0.31996964593322436,0.06507003803005834
D3/0_antigen presentation (lipids and proteins) (M28),outcome,34,-0.319168832406581,0.06578272161061441
"D1/0_metabolism in mitochondria, peroxisome (M187)",outcome,34,0.3187077956628975,0.06619579050931969
D3/0_enriched in activated dendritic cells/monocytes (M64),outcome,34,-0.3181580730111205,0.06669097416100533
D7/0_chemokines and inflammatory molecules in myeloid cells (M86.0),outcome,34,-0.31639082345749625,0.06830258786841052
D3/0_cell cell adhesion (M133.1),outcome,34,0.3135369727789449,0.07096928373938902
D7/0_enriched for TF motif TTCNRGNNNNTTC (M172),outcome,34,-0.31193149910332196,0.0725047909184183
D7/0_enriched in neutrophils (II) (M163),outcome,34,-0.31185484050127243,0.07257875122012176
"D7/0_RA, WNT, CSF receptors network (monocyte) (M23)",outcome,34,-0.3106271883614138,0.07377121956470792
"D3/0_CCR1, 7 and cell signaling (M59)",outcome,34,-0.31030732607355727,0.07408440521703324
D3/0_enriched in monocytes (II) (M11.0),outcome,34,-0.3082186726022473,0.07615496812729135
D7/0_enriched in B cells (III) (M47.2),outcome,34,0.30805953525460134,0.07631455072062283
D7/0_regulation of localization (GO) (M63),outcome,34,-0.30750737292400615,0.07687027199103072
D7/0_AP-1 transcription factor network (M20),outcome,34,-0.30717783361409445,0.07720342856334192
D3/0_cell junction (M162.1),outcome,34,0.30662349459081273,0.07776637801637014
D1/0_cell cycle (I) (M4.1),outcome,34,-0.3061661851426782,0.07823318212006401
D3/0_inflammatory response (M33),outcome,34,-0.30598240843618146,0.07842138489945617
D1/0_cell division in stimulated CD4 T cells (M4.6),outcome,34,-0.30460143056156597,0.07984686624918479
D1/0_cytoskeleton/actin (SRF transcription targets) (M145.1),outcome,34,-0.3023008807188942,0.08226597397074487
D7/0_recruitment of neutrophils (M132),outcome,34,-0.30156149574927116,0.08305535716005877
D1/0_enriched in neutrophils (I) (M37.1),outcome,34,-0.3013742768539457,0.08325616001809966
D7/0_leukocyte differentiation (M160),outcome,34,-0.30002163093030276,0.0847180934319591
D1/0_chromosome Y linked (M240),outcome,34,-0.29945334310920735,0.08533816127642463
"D7/0_proinflammatory dendritic cell, myeloid cell response (M86.1)",outcome,34,-0.29934141160267136,0.08546070221654076
D3/0_cell cycle and transcription (M4.0),outcome,34,-0.2991059982149159,0.08571887114364182
D7/0_enriched for TF motif PAX3 (M179),outcome,34,0.2983317718975331,0.08657216913366872
D7/0_antiviral IFN signature (M75),outcome,34,-0.29423703896813286,0.09119414038233928
D7/0_TBA (M48),outcome,34,-0.29385461656951334,0.0916352622962949
"D3/0_receptors, cell migration (M109)",outcome,34,-0.29362295674630934,0.09190327339045717
D7/0_complement and other receptors in DCs (M40),outcome,34,-0.2933621874251282,0.09220567862811198
D3/0_Hox cluster I (M17.0),outcome,34,0.2929853596525998,0.09264401637650829
D1/0_TBA (M183),outcome,34,-0.29231788771609823,0.09342434757628136
D1/0_olfactory receptors (M228),outcome,34,0.29187219818977567,0.09394818497582766
D7/0_DC surface signature (S5),outcome,34,-0.290219709785606,0.09591001090413073
D7/0_TLR and inflammatory signaling (M16),outcome,34,-0.2887321701466937,0.09770257110158834
D1/0_enriched for promoter motif NATCACGTGAY (putative SREBF1 targets) (M178),outcome,34,0.28842230620456616,0.09807915954037295
D7/0_TBA (M98.0),outcome,34,-0.2880362111244939,0.0985499378383744
D7/0_enriched in antigen presentation (III) (M95.1),outcome,34,-0.2874338570566882,0.09928783573139867
D1/0_transcription regulation in cell development (M49),outcome,34,-0.28737014481840373,0.09936612950359226
D3/0_TBA (M66),outcome,34,-0.28684622683806577,0.10001173382748274
"D7/0_IL2, IL7, TCR network (M65)",outcome,34,0.2814857471721728,0.10680147924997133
D7/0_innate activation by cytosolic DNA sensing (M13),outcome,34,-0.2812420036345205,0.10711827448945234
D3/0_TBA (M26.2),outcome,34,0.2807212075865814,0.10779753129226335
D1/0_cell adhesion (GO) (M117),outcome,34,-0.2805732780649238,0.10799106161363572
D7/0_Hox cluster IV (M17.3),outcome,34,0.27868920011092163,0.11047888756561913
D1/0_Naive B cell surface signature (S8),outcome,34,0.27711208623871075,0.1125943162915989
"D7/0_growth factor induced, enriched in nuclear receptor subfamily 4 (M94)",outcome,34,-0.27706379164642203,0.11265957151658974
D7/0_enriched in monocytes (III) (M73),outcome,34,-0.2766303604421313,0.11324649095049011
D3/0_TBA (M116),outcome,34,0.2765246413655359,0.11338999495125804
"D7/0_extracellular matrix, complement (M140)",outcome,34,-0.27591382871027714,0.11422178905738493
D3/0_golgi membrane (I) (M113),outcome,34,-0.2757605807014195,0.11443119528930668
D3/0_TBA (M26.0),outcome,34,0.27490437043028215,0.11560646336073237
D1/0_enriched in NK cells (III) (M157),outcome,34,0.2739691678137868,0.11690045786373567
D3/0_mitotic cell cycle in stimulated CD4 T cells (M4.9),outcome,34,-0.2733005550023526,0.1178322019738328
D3/0_TBA (M214),outcome,34,-0.27279202242213074,0.11854457250822292
D7/0_putative targets of PAX3 (M89.1),outcome,34,-0.272336873006878,0.11918488422263498
D7/0_proinflammatory cytokines and chemokines (M29),outcome,34,-0.2721403072426,0.11946221265688664
D3/0_enriched for unknown TF motif CTCNANGTGNY (M62.1),outcome,34,0.2719704698137596,0.11970221830801069
D7/0_TBA (M176),outcome,34,0.27166980694446535,0.12012798135145163
D7/0_enriched in activated dendritic cells (I) (M119),outcome,34,-0.2704914567532557,0.12180750806098345
D7/0_TBA (M26.2),outcome,34,-0.26862974115014493,0.12449658263434192
D7/0_Hox cluster I (M17.0),outcome,34,0.26811635162493547,0.12524582164147427
D3/0_TBA (source: B cells) (M217),outcome,34,0.26807367526543113,0.12530825368569412
D1/0_transcriptional targets of glucocorticoid receptor (M74),outcome,34,0.2666042420494819,0.12747202945795563
D1/0_TBA (M176),outcome,34,0.26644002170420894,0.12771555617555344
D1/0_cell cycle (III) (M103),outcome,34,-0.2663097698660458,0.12790895494275772
D3/0_enriched in B cells (V) (M47.4),outcome,34,0.2660601750546355,0.12828016062262335
"D3/0_metabolism in mitochondria, peroxisome (M187)",outcome,34,0.26595166841159273,0.1284417837143304
D7/0_TBA (M55),outcome,34,-0.2657833848768008,0.12869274384419438
D3/0_Resting dendritic cell surface signature (S10),outcome,34,-0.2654024453632299,0.12926217626125636
D3/0_Hox cluster II (M17.1),outcome,34,0.26536280457015804,0.1293215385934098
D7/0_mitotic cell cycle - DNA replication (M4.4),outcome,34,-0.2652211525516305,0.1295338280868663
D1/0_mitotic cell division (M6),outcome,34,-0.26428506425136167,0.13094319590506998
D1/0_Hox cluster VI (M107),outcome,34,0.263864337076444,0.13158031473811385
D1/0_enriched in G-protein coupled receptors (M130),outcome,34,0.26339810534951374,0.1322890113455998
D7/0_extracellular matrix (II) (M2.1),outcome,34,-0.263059391152461,0.13280563731698103
D1/0_enriched for TF motif TTCNRGNNNNTTC (M172),outcome,34,-0.2623240637777364,0.13393231677935974
D3/0_enriched in hepatocyte nuclear factors (I) (M88.1),outcome,34,0.26166389456813643,0.13494982055529828
D7/0_Resting dendritic cell surface signature (S10),outcome,34,-0.26149173691748057,0.13521609574915913
D7/0_KLF12 targets network (M32.3),outcome,34,-0.26068530593066314,0.1364685448013022
D7/0_TBA (M174),outcome,34,0.26042611712729025,0.1368728892668864
D7/0_MHC-TLR7-TLR8 cluster (M146),outcome,34,-0.26033215090965534,0.13701969730019528
D7/0_B cell development/activation (M58),outcome,34,0.25944733045280427,0.13840777174299235
"D7/0_T & B cell development, activation (M62.0)",outcome,34,0.2591189191026108,0.13892558747056508
D3/0_mitotic cell cycle (M4.7),outcome,34,-0.2572620073047824,0.1418801826035641
D7/0_blood coagulation (M11.1),outcome,34,-0.25636823848301654,0.14331855802632046
D1/0_recruitment of neutrophils (M132),outcome,34,-0.25620281258082805,0.1435859479601944
D3/0_TBA (M80),outcome,34,0.2561888104702185,0.14360859730222725
"D7/0_cell activation (IL15, IL23, TNF) (M24)",outcome,34,-0.25467713791042473,0.14606920074264554
D7/0_TBA (M79),outcome,34,-0.2544977195276708,0.14636327316303857
D7/0_inflammatory response (M33),outcome,34,-0.253703114794001,0.14767084125725696
D3/0_integrin cell surface interactions (I) (M1.0),outcome,34,0.2536972142948397,0.14768058255595923
"D7/0_signal transduction, plasma membrane (M82)",outcome,34,-0.25325388927127335,0.14841381820452584
D1/0_enriched in naive and memory B cells (M83),outcome,34,0.25305590828682867,0.14874212174749113
D7/0_integrin mediated leukocyte migration (M39),outcome,34,0.25267166677948666,0.1493807993393955
D1/0_transmembrane and ion transporters (II) (M224),outcome,34,0.25218254198227663,0.15019669111488904
D7/0_enriched in B cells (V) (M47.4),outcome,34,0.25180342210375123,0.1508313097387413
D3/0_enriched in monocytes (surface) (M118.1),outcome,34,-0.2513093865618078,0.15166120550339135
D7/0_TBA (M26.1),outcome,34,-0.2509228470154035,0.152312831240269
D3/0_TBA (M246),outcome,34,-0.25080689674419304,0.15250869443421283
D3/0_Ran mediated mitosis (M15),outcome,34,0.25069154099984303,0.15270373438558313
D7/0_TLR8-BAFF network (M25),outcome,34,-0.25044149652787073,0.15312712214291532
D7/0_T cell differentiation (M14),outcome,34,0.24998226695381567,0.1539069258065555
D3/0_enriched for SMAD2/3 signaling (M97),outcome,34,0.2499194344399586,0.15401384286541428
D1/0_TBA (M194),outcome,34,0.24936071700781767,0.15496693236505743
D7/0_cytokines - recepters cluster (M115),outcome,34,-0.248236800993365,0.15689707090923474
D1/0_translation initiation (M227),outcome,34,0.24756368439750184,0.15806131209598295
D7/0_Hox cluster III (M17.2),outcome,34,0.24753429251236647,0.15811229067201332
D7/0_formyl peptide receptor mediated neutrophil response (M11.2),outcome,34,-0.24703020598528644,0.15898844655210842
D3/0_TBA (M90),outcome,34,0.2453974271959768,0.1618503981831255
D1/0_enriched for TF motif TNCATNTCCYR (M232),outcome,34,0.24491239789446903,0.16270765125531225
D3/0_extracellular matrix (I) (M2.0),outcome,34,0.24486193305394885,0.16279703101948761
D3/0_TBA (M104),outcome,34,0.24445870446232348,0.163512467758207
"D3/0_plasma cells, immunoglobulins (M156.1)",outcome,34,0.24315671554024543,0.1658379501892831
D3/0_enriched in hepatocyte nuclear factors (II) (M88.2),outcome,34,0.2418002351950491,0.16828585625316178
D7/0_enriched in NK cells (receptor activation) (M61.2),outcome,34,-0.24099891788057728,0.16974399073470878
D7/0_cell division in stimulated CD4 T cells (M4.6),outcome,34,-0.23987017215018047,0.171813203663134
D7/0_enriched in activated dendritic cells (II) (M165),outcome,34,-0.23963543391495984,0.17224577270159896
D7/0_nuclear pore complex (M106.0),outcome,34,0.2395363923058331,0.17242851629337874
D7/0_putative targets of PAX3 (M89.0),outcome,34,-0.23934544074638847,0.17278123435511342
D3/0_antiviral IFN signature (M75),outcome,34,-0.23893880010151844,0.17353407569935525
D3/0_TBA (M208),outcome,34,0.23756614168127826,0.1760926012573122
D1/0_cell division (stimulated CD4+ T cells) (M46),outcome,34,-0.23707588446363165,0.17701285863561
D3/0_enriched in monocytes (III) (M73),outcome,34,-0.23684511323442828,0.17744721595459712
D3/0_TBA (M177.0),outcome,34,-0.23664998872192855,0.17781506827926524
D1/0_enriched in B cells (IV) (M47.3),outcome,34,0.2365717832179745,0.1779626543655991
D7/0_T cell activation (III) (M7.4),outcome,34,0.23604094595096303,0.17896672283976192
"D1/0_immuregulation - monocytes, T and B cells (M57)",outcome,34,0.23577640400564373,0.1794685937112921
D7/0_cell adhesion (M51),outcome,34,-0.23486687475189982,0.18120168881940923
D7/0_immune activation - generic cluster (M37.0),outcome,34,-0.234550077407751,0.18180810982605528
D7/0_TBA (M136),outcome,34,-0.23444259743365564,0.18201417586098007
D3/0_endoplasmic reticulum (M37.2),outcome,34,-0.23358731337045463,0.18365985066323007
D7/0_Hox cluster II (M17.1),outcome,34,0.23338874580204813,0.18404341588207204
D7/0_cell cycle and transcription (M4.0),outcome,34,-0.2332966724753329,0.1842214618444163
D1/0_B cell surface signature (S2),outcome,34,0.232696622576974,0.1853847774072134
D3/0_immune activation - generic cluster (M37.0),outcome,34,-0.23100364991038466,0.18869480108361913
D3/0_blood coagulation (M11.1),outcome,34,-0.23098132071247365,0.18873873354964782
D7/0_Monocyte surface signature (S4),outcome,34,-0.23077523929385216,0.18914453564886807
D1/0_TBA (source: B cells) (M152.0),outcome,34,0.2307705983074578,0.18915368142212266
D1/0_targets of FOSL1/2 (M0),outcome,34,-0.2298341356704749,0.19100547927102096
"D7/0_lipid metabolism, endoplasmic reticulum (M92)",outcome,34,-0.22917410893082518,0.19231825027735527
D7/0_CD4 T cell surface signature Th2-stimulated (S7),outcome,34,0.22890911140664666,0.1928470940527747
D1/0_KLF12 targets network (M32.3),outcome,34,-0.2283603491622923,0.19394546749532826
D1/0_enriched in activated dendritic cells/monocytes (M64),outcome,34,-0.22835552599790657,0.19395514062892785
D3/0_inflammasome receptors and signaling (M53),outcome,34,-0.2277814545535508,0.1951088836364432
"D1/0_MAPK, RAS signaling (M100)",outcome,34,-0.22756637821199738,0.19554236586653792
D7/0_B cell development (M9),outcome,34,-0.22728759945727706,0.19610523882910957
D3/0_Hox cluster VI (M107),outcome,34,0.22705731662036924,0.19657104702299433
D1/0_TBA (M121),outcome,34,0.22683728908586334,0.197016831430111
D3/0_TBA (M184.0),outcome,34,0.22610469355165508,0.19850617669275167
D7/0_transmembrane and ion transporters (I) (M142),outcome,34,0.2260626810982282,0.19859182375059334
D7/0_metabolism of steroids (M225),outcome,34,-0.2255809184469076,0.19957578965461747
"D7/0_myeloid cell cytokines, metallopeptidases and laminins (M78)",outcome,34,-0.22496702532634053,0.2008345291978579
D1/0_enriched in calcium signaling proteins (M239),outcome,34,0.2246468718737768,0.20149316234809145
D3/0_regulation of localization (GO) (M63),outcome,34,-0.22375028600658375,0.20334563333116706
"D1/0_lipid metabolism, endoplasmic reticulum (M92)",outcome,34,-0.22357994016284666,0.20369892178646398
D1/0_TBA (M229),outcome,34,-0.22192319317199816,0.2071571276286882
"D1/0_myeloid, dendritic cell activation via NFkB (I) (M43.0)",outcome,34,-0.22168581323730438,0.20765592392399976
D7/0_TBA (M203),outcome,34,0.2215165428286162,0.20801211080487625
D1/0_enriched in B cells (VI) (M69),outcome,34,0.22149253609790054,0.20806266104751364
D7/0_TBA (M137),outcome,34,0.22146132270667412,0.2081283988172795
D3/0_complement activation (II) (M112.1),outcome,34,0.22138305567143948,0.20829329818001358
D3/0_small GTPase mediated signal transduction (M215),outcome,34,-0.2213610324296063,0.20833971479248697
D7/0_TBA (M93),outcome,34,-0.2212403893784792,0.20859411110629003
D1/0_TBA (M198),outcome,34,-0.21992910159804693,0.21137301614227147
D1/0_putative targets of PAX3 (M89.1),outcome,34,-0.21875268424322056,0.21388769753723325
D7/0_T cell differentiation (Th2) (M19),outcome,34,0.2185923771387582,0.21423195009935636
D1/0_enriched in B cells (II) (M47.1),outcome,34,0.21851827033795226,0.21439121976425282
D7/0_enriched in NK cells (II) (M61.0),outcome,34,-0.2179939921206236,0.21552031583545816
D1/0_chaperonin mediated protein folding (II) (M204.1),outcome,34,0.2175112699992767,0.21656351623612596
D1/0_TBA (M80),outcome,34,0.21738916288279767,0.21682794668294333
D7/0_TBA (M151),outcome,34,0.2172100124571635,0.21721630811225845
D3/0_TBA (M149),outcome,34,0.21634049495354388,0.21910801005367656
D1/0_cell cell adhesion (M133.1),outcome,34,0.2158366945719773,0.22020920497578586
D7/0_TBA (M220),outcome,34,-0.215337723203968,0.22130356490033432
D3/0_KLF12 targets network (M32.3),outcome,34,-0.21467777757304632,0.22275667051317952
D1/0_axon guidance (M110),outcome,34,0.21430929790288264,0.22357083244873546
D1/0_chaperonin mediated protein folding (I) (M204.0),outcome,34,0.21407855445581242,0.22408169447787102
D1/0_TBA (M197),outcome,34,0.21398129946492095,0.2242972532071618
D7/0_endoplasmic reticulum (M37.2),outcome,34,-0.2136943127023217,0.22493416132006536
"D1/0_muscle contraction, SRF targets (M195)",outcome,34,-0.21362999146013015,0.22507707767302293
D1/0_TBA (M102),outcome,34,0.21353634468095467,0.2252852632758001
D3/0_cell development (M175),outcome,34,0.21294363330291263,0.2266059533691226
"D1/0_growth factor induced, enriched in nuclear receptor subfamily 4 (M94)",outcome,34,-0.2127297798133821,0.22708375378624074
D7/0_T cell activation (I) (M7.1),outcome,34,0.21218778968137245,0.2282977525641476
D3/0_regulation of antigen presentation and immune response (M5.0),outcome,34,-0.2119174172136346,0.2289049998183495
D3/0_TBA (M244),outcome,34,0.21182168431703777,0.2291202748105888
D1/0_enriched in nuclear pore complex interacting proteins (M247),outcome,34,-0.21147324418775687,0.22990497193984452
D7/0_TBA (M105),outcome,34,-0.21121069664509104,0.23049743743175594
D3/0_TBA (M197),outcome,34,0.21102365244083476,0.23092015169222768
D7/0_mitotic cell cycle in stimulated CD4 T cells (M4.9),outcome,34,-0.21061493210108267,0.23184567175253123
D3/0_TBA (M174),outcome,34,0.21053242848854406,0.23203279945349164
D3/0_TBA (M249),outcome,34,-0.21010617854989722,0.2330012094526231
D7/0_inflammasome receptors and signaling (M53),outcome,34,-0.21010487767295186,0.23300416912530297
D3/0_TBA (source: B cells) (M152.0),outcome,34,0.20971351696137097,0.23389572115381063
D3/0_TBA (source: naive B cells) (M152.1),outcome,34,0.20968404002902022,0.23396296513083686
D3/0_cell division (stimulated CD4+ T cells) (M46),outcome,34,-0.2094213682162202,0.234562758805022
D3/0_transmembrane transport (I) (M87),outcome,34,-0.20932962618934406,0.23477248975965082
D3/0_lysosomal/endosomal proteins (M139),outcome,34,-0.20931406416994847,0.23480807854788194
D7/0_transmembrane transport (I) (M87),outcome,34,-0.20928546393434286,0.23487349392289877
D7/0_T cell activation and signaling (M5.1),outcome,34,0.20920190553222742,0.2350646817595801
D1/0_E2F1 targets (Q3) (M10.0),outcome,34,-0.20853274289936327,0.2365995597000147
D7/0_TBA (M192),outcome,34,-0.20830910315569154,0.23711402940872614
D3/0_integrins and cell adhesion (M84),outcome,34,-0.2082128394464256,0.23733570980522076
D3/0_ATF targets network (M41.4),outcome,34,0.20817911835742778,0.23741339720792518
D7/0_Naive B cell surface signature (S8),outcome,34,0.2073481771736804,0.23933314362497046
D1/0_enriched in B cells (III) (M47.2),outcome,34,0.2070682351063343,0.23998224231076287
D1/0_TBA (M218),outcome,34,0.20696447168652843,0.24022313728253375
D3/0_TBA (M99),outcome,34,0.20683728207246665,0.24051863927700237
D3/0_enriched in NK cells (KIR cluster) (M61.1),outcome,34,-0.20568591767686184,0.24320472005008845
"D7/0_nuclear pore, transport; mRNA splicing, processing (M143)",outcome,34,0.2056851366334629,0.24320654897423838
D1/0_enriched in B cells (I) (M47.0),outcome,34,0.20399779216352548,0.24717920764093929
D7/0_signaling in T cells (II) (M35.1),outcome,34,-0.2038592602430261,0.24750727576407158
