BTM,target,n,r,p_value
D3/0_transmembrane transport (I) (M87),tPLS_Comp1,34,-0.560542279902074,5.647879406877034e-4
"D3/0_collagen, TGFB family et al (M77)",tPLS_Comp1,34,0.5603641826884096,5.675780282107078e-4
D7/0_TBA (M136),tPLS_Comp1,34,-0.5594406741408589,5.822425410419364e-4
D1/0_TLR and inflammatory signaling (M16),tPLS_Comp1,34,-0.5581462577486658,6.03361371007236e-4
"D7/0_cell activation (IL15, IL23, TNF) (M24)",tPLS_Comp1,34,-0.5577599779571301,6.097936782772791e-4
D1/0_mitotic cell cycle - DNA replication (M4.4),tPLS_Comp1,34,-0.555540962973321,6.479343306262555e-4
D1/0_transcription regulation in cell development (M49),tPLS_Comp1,34,-0.5552393302354157,6.532784773452193e-4
D7/0_putative targets of PAX3 (M89.0),tPLS_Comp1,34,-0.5550948040609784,6.558528956888334e-4
D3/0_TBA (M102),tPLS_Comp1,34,0.5546460788516682,6.639032423554946e-4
D3/0_regulation of signal transduction (M3),tPLS_Comp1,34,-0.5546363121153043,6.640794299614679e-4
D1/0_TBA (M131),tPLS_Comp1,34,-0.5535724765821411,6.835199551414925e-4
D1/0_cell cycle (I) (M4.1),tPLS_Comp1,34,-0.5515013786639763,7.228159499162585e-4
D7/0_inflammatory response (M33),tPLS_Comp1,34,-0.5505316596279392,7.418915672702481e-4
D1/0_transcriptional targets of glucocorticoid receptor (M74),tPLS_Comp1,34,0.549962798282705,7.532876104333082e-4
D7/0_putative targets of PAX3 (M89.1),tPLS_Comp1,34,-0.549553305529193,7.615864657591896e-4
D7/0_signaling in T cells (I) (M35.0),tPLS_Comp1,34,-0.5494451758366448,7.637912757685122e-4
D7/0_enriched in B cells (II) (M47.1),tPLS_Comp1,34,0.5492176351129895,7.684493514769908e-4
D3/0_TBA (M114.0),tPLS_Comp1,34,-0.5489126182107809,7.747328263782941e-4
D3/0_olfactory receptors (M228),tPLS_Comp1,34,0.5481851605561837,7.899022695279316e-4
D1/0_leukocyte differentiation (M160),tPLS_Comp1,34,-0.5474155101294863,8.0623650577551e-4
D7/0_enriched in antigen presentation (III) (M95.1),tPLS_Comp1,34,-0.547068648986103,8.1369488087065e-4
D7/0_enriched in monocytes (II) (M11.0),tPLS_Comp1,34,-0.5467041077598399,8.215989995884136e-4
D3/0_immune activation - generic cluster (M37.0),tPLS_Comp1,34,-0.546237488720638,8.318152531070617e-4
D7/0_proinflammatory cytokines and chemokines (M29),tPLS_Comp1,34,-0.5456842316399562,8.440735189658263e-4
D7/0_B cell development (M9),tPLS_Comp1,34,-0.5456058676274652,8.458226198758399e-4
D1/0_TBA (M102),tPLS_Comp1,34,0.5448534978114409,8.627791143801296e-4
D1/0_enriched in neutrophils (II) (M163),tPLS_Comp1,34,-0.5436040149567214,8.916024541774369e-4
D7/0_enriched in monocytes (IV) (M118.0),tPLS_Comp1,34,-0.5410913745697393,9.52146850566037e-4
D1/0_Hox cluster VI (M107),tPLS_Comp1,34,0.5395582896773888,9.908421566932194e-4
D7/0_enriched for TF motif PAX3 (M179),tPLS_Comp1,34,0.5378612625194503,0.0010352847035360242
D3/0_B cell development (M9),tPLS_Comp1,34,-0.5372592545697586,0.0010514668899129999
D1/0_enriched in activated dendritic cells (II) (M165),tPLS_Comp1,34,-0.5371488327884704,0.0010544591106596945
D3/0_antigen presentation (lipids and proteins) (M28),tPLS_Comp1,34,-0.5367432317441496,0.0010655145615233136
"D7/0_growth factor induced, enriched in nuclear receptor subfamily 4 (M94)",tPLS_Comp1,34,-0.5367351849409256,0.0010657349210410555
D1/0_endoplasmic reticulum (M37.2),tPLS_Comp1,34,-0.5364130946269627,0.0010745882770085504
D3/0_KLF12 targets network (M32.3),tPLS_Comp1,34,-0.5363038469618612,0.0010776058533541583
D1/0_Monocyte surface signature (S4),tPLS_Comp1,34,-0.5362875394420489,0.0010780569293669933
"D1/0_MAPK, RAS signaling (M100)",tPLS_Comp1,34,-0.5354652792948148,0.0011010176709126116
D7/0_TBA (M198),tPLS_Comp1,34,-0.5349809811222421,0.0011147415698137442
D1/0_cell junction (GO) (M4.13),tPLS_Comp1,34,-0.5347783487693298,0.0011205282126423412
D1/0_enriched in monocytes (IV) (M118.0),tPLS_Comp1,34,-0.5341215007470723,0.0011394681150643275
D1/0_B cell development (M9),tPLS_Comp1,34,-0.5332102214483497,0.0011662104907316547
D7/0_myeloid cell enriched receptors and transporters (M4.3),tPLS_Comp1,34,-0.5331722360875806,0.0011673370886641319
D7/0_TBA (M241),tPLS_Comp1,34,0.5320997586232483,0.001199542871414326
"D7/0_myeloid, dendritic cell activation via NFkB (I) (M43.0)",tPLS_Comp1,34,-0.5283016978181025,0.0013199643930433412
D1/0_enriched for promoter motif NATCACGTGAY (putative SREBF1 targets) (M178),tPLS_Comp1,34,0.5278410513383166,0.0013352679159349071
"D7/0_proinflammatory dendritic cell, myeloid cell response (M86.1)",tPLS_Comp1,34,-0.5271133221331019,0.001359761880565572
D7/0_G protein coupled receptors cluster (M155),tPLS_Comp1,34,-0.5266038964960998,0.0013771419633603291
D1/0_platelet activation (II) (M32.1),tPLS_Comp1,34,-0.5265397345645493,0.001379344739540419
D1/0_platelet activation (I) (M32.0),tPLS_Comp1,34,-0.5255599738173458,0.0014133675710806192
D7/0_enriched in activated dendritic cells (II) (M165),tPLS_Comp1,34,-0.5247670779866879,0.0014414381000125097
"D7/0_myeloid cell cytokines, metallopeptidases and laminins (M78)",tPLS_Comp1,34,-0.5212719334430873,0.0015710862144087013
D1/0_MHC-TLR7-TLR8 cluster (M146),tPLS_Comp1,34,-0.5209054769416432,0.0015852536214044607
D1/0_enriched in monocytes (III) (M73),tPLS_Comp1,34,-0.5206616386353243,0.0015947424327381297
D7/0_Ran mediated mitosis (M15),tPLS_Comp1,34,-0.5191081131739629,0.0016563734138917946
D1/0_TBA (M177.1),tPLS_Comp1,34,0.5186586477463787,0.001674588960483194
D3/0_enriched in activated dendritic cells (I) (M119),tPLS_Comp1,34,-0.518625524502842,0.0016759382612168213
D7/0_regulation of signal transduction (M3),tPLS_Comp1,34,-0.5173568011391041,0.001728342249604251
D3/0_complement activation (I) (M112.0),tPLS_Comp1,34,-0.516783918936053,0.0017524709547900997
D1/0_DC surface signature (S5),tPLS_Comp1,34,-0.513235340299861,0.0019086020729560318
D3/0_enriched in G-protein coupled receptors (M130),tPLS_Comp1,34,0.5129859438927463,0.0019200184367830207
"D3/0_receptors, cell migration (M109)",tPLS_Comp1,34,-0.5121836574391269,0.001957149585956392
"D7/0_myeloid, dendritic cell activation via NFkB (II) (M43.1)",tPLS_Comp1,34,-0.5105214347855649,0.002036081259302081
D1/0_TBA (M136),tPLS_Comp1,34,-0.510419354297414,0.0020410179188002585
D7/0_cell cycle (I) (M4.1),tPLS_Comp1,34,-0.5068026616138369,0.002222803204005709
D7/0_formyl peptide receptor mediated neutrophil response (M11.2),tPLS_Comp1,34,-0.5067437777969231,0.0022258760215918285
"D1/0_plasma cells & B cells, immunoglobulins (M156.0)",tPLS_Comp1,34,0.506360339892677,0.00224597624653832
D3/0_enriched for promoter motif NATCACGTGAY (putative SREBF1 targets) (M178),tPLS_Comp1,34,0.5056948670001886,0.002281236873637448
D3/0_enriched in NK cells (III) (M157),tPLS_Comp1,34,0.5049715608329244,0.002320108172525199
"D3/0_immuregulation - monocytes, T and B cells (M57)",tPLS_Comp1,34,0.5039070589405711,0.0023783652911770438
D1/0_enriched in NK cells (III) (M157),tPLS_Comp1,34,0.5015420863552219,0.002512372762265216
D1/0_TBA (M141),tPLS_Comp1,34,-0.5000834582120512,0.0025982602507497767
D7/0_TBA (M26.0),tPLS_Comp1,34,-0.499123844720494,0.002656147628606498
D1/0_TBA (M80),tPLS_Comp1,34,0.498579239350257,0.002689496537680846
"D1/0_immuregulation - monocytes, T and B cells (M57)",tPLS_Comp1,34,0.4972422915680663,0.0027729127594064637
D1/0_cytoskeletal remodeling (M32.8),tPLS_Comp1,34,-0.49709930861461143,0.002781965594973126
D1/0_chemokines and inflammatory molecules in myeloid cells (M86.0),tPLS_Comp1,34,-0.49558891085728657,0.002879175012986188
D7/0_TBA (M141),tPLS_Comp1,34,-0.4951315326513943,0.0029091879800220138
D1/0_cell cycle (II) (M4.10),tPLS_Comp1,34,-0.49410699122891316,0.0029774056983180334
D7/0_golgi membrane (I) (M113),tPLS_Comp1,34,-0.49372152631170907,0.003003428556719432
D7/0_chemokine cluster (I) (M27.0),tPLS_Comp1,34,-0.4932901388084915,0.00303278557075642
D1/0_blood coagulation (M11.1),tPLS_Comp1,34,-0.4917816725206282,0.0031374075381773803
D1/0_AP-1 transcription factor network (M20),tPLS_Comp1,34,-0.4916700041062268,0.0031452754370945267
D1/0_transmembrane transport (I) (M87),tPLS_Comp1,34,-0.4909820625493745,0.003194124761433102
D1/0_TBA (source: B cells) (M152.0),tPLS_Comp1,34,0.4905182841505787,0.003227426797067366
D7/0_T cell differentiation via ITK and PKC (M18),tPLS_Comp1,34,0.4883616863945047,0.0033862686376030385
D1/0_TBA (M192),tPLS_Comp1,34,-0.48483719748617266,0.003660452104670914
"D1/0_myeloid, dendritic cell activation via NFkB (I) (M43.0)",tPLS_Comp1,34,-0.48247696781257027,0.0038546225474703094
D7/0_transmembrane transport (I) (M87),tPLS_Comp1,34,-0.48149270115340226,0.003938189406313739
D7/0_cell division (stimulated CD4+ T cells) (M46),tPLS_Comp1,34,-0.48106786499276505,0.003974740053794775
D3/0_respiratory electron transport chain (mitochondrion) (M219),tPLS_Comp1,34,-0.47842016167162726,0.00420920806696013
"D7/0_IL2, IL7, TCR network (M65)",tPLS_Comp1,34,0.47811196450227206,0.004237260931636349
D3/0_TBA (M176),tPLS_Comp1,34,0.4774381090697858,0.004299159562945421
D3/0_T cell activation (IV) (M52),tPLS_Comp1,34,0.47587513650716046,0.004445741411347071
D1/0_TBA (M32.5),tPLS_Comp1,34,-0.4758123117570212,0.004451722371520722
D1/0_TBA (M48),tPLS_Comp1,34,-0.47571956532220205,0.004460564579159332
D7/0_leukocyte activation and migration (M45),tPLS_Comp1,34,0.47556711413560443,0.004475131791914449
D3/0_enriched for TF motif PAX3 (M179),tPLS_Comp1,34,0.4752523284576229,0.0045053404424153076
D7/0_mitotic cell cycle in stimulated CD4 T cells (M4.9),tPLS_Comp1,34,-0.474738397010699,0.004555038121846727
"D3/0_plasma cells, immunoglobulins (M156.1)",tPLS_Comp1,34,0.47471975445960035,0.004556849720912273
D3/0_chemokines and inflammatory molecules in myeloid cells (M86.0),tPLS_Comp1,34,-0.4721508953483693,0.004812494937747551
D3/0_cell division in stimulated CD4 T cells (M4.6),tPLS_Comp1,34,-0.47050727945193543,0.004982461995633801
D7/0_T cell activation and signaling (M5.1),tPLS_Comp1,34,0.4703026725290763,0.0050039777262417436
D7/0_T cell activation (III) (M7.4),tPLS_Comp1,34,0.4702242992941272,0.005012240325588488
D3/0_antigen processing and presentation (M200),tPLS_Comp1,34,-0.46936273400951667,0.00510384863557122
D1/0_inflammatory response (M33),tPLS_Comp1,34,-0.46476425908272384,0.005617539925672174
D7/0_T cell activation (I) (M7.1),tPLS_Comp1,34,0.4639186777300657,0.005716677252187712
D7/0_TBA (M41.2),tPLS_Comp1,34,-0.46319399100130537,0.005802831933865879
D7/0_TBA (M98.1),tPLS_Comp1,34,-0.4629587113677733,0.005831041741019105
D1/0_TBA (M188),tPLS_Comp1,34,-0.46292674967553127,0.005834882979908927
D7/0_glycerophospholipid metabolism (M114.1),tPLS_Comp1,34,-0.46266699248858945,0.005866181867463413
D1/0_TBA (M32.6),tPLS_Comp1,34,-0.46221090508389195,0.005921485645284969
D1/0_double positive thymocytes (M126),tPLS_Comp1,34,0.46089663274166115,0.006083358104276179
D3/0_enriched in activated dendritic cells (II) (M165),tPLS_Comp1,34,-0.459948954390993,0.006202419411440324
D1/0_enriched for TF motif PAX3 (M179),tPLS_Comp1,34,0.4598672035079691,0.006212783068935824
"D7/0_MAPK, RAS signaling (M100)",tPLS_Comp1,34,-0.45870846576160484,0.006361280986561715
D1/0_inflammasome receptors and signaling (M53),tPLS_Comp1,34,-0.4568049455020147,0.006611825403721616
D1/0_enriched in monocytes (II) (M11.0),tPLS_Comp1,34,-0.4565386820134874,0.006647535735855686
D1/0_antiviral IFN signature (M75),tPLS_Comp1,34,-0.4562772052658834,0.006682764560975321
D1/0_CORO1A-DEF6 network (I) (M32.2),tPLS_Comp1,34,-0.45539464365362464,0.006802854212282059
D7/0_lysosome (M209),tPLS_Comp1,34,-0.4527716833674976,0.0071707119712173
D1/0_TBA (M183),tPLS_Comp1,34,-0.45239175124207265,0.007225379240368211
D7/0_viral sensing & immunity; IRF2 targets network (I) (M111.0),tPLS_Comp1,34,-0.4505644845854856,0.0074932994073499525
D3/0_Activated (LPS) dendritic cell surface signature (S11),tPLS_Comp1,34,-0.4500837869319825,0.007565173400989623
D7/0_TBA (M98.0),tPLS_Comp1,34,-0.4495999758729336,0.00763810604324103
D7/0_enriched in NK cells (III) (M157),tPLS_Comp1,34,0.4493552007622202,0.007675232867924192
D1/0_TBA (M176),tPLS_Comp1,34,0.4475596855372299,0.007952307355181406
D7/0_KLF12 targets network (M32.3),tPLS_Comp1,34,-0.4466930679241803,0.008089060776255666
D1/0_enriched in monocytes (surface) (M118.1),tPLS_Comp1,34,-0.44660218300300125,0.008103517923078323
D7/0_enriched in naive and memory B cells (M83),tPLS_Comp1,34,0.44653244814559717,0.008114625629589131
D7/0_TBA (M149),tPLS_Comp1,34,-0.4464050764588258,0.008134947493997145
D1/0_cell cycle and growth arrest (M31),tPLS_Comp1,34,-0.44559068447564176,0.008265909428497788
D7/0_E2F transcription factor network (M8),tPLS_Comp1,34,-0.4451794596730092,0.00833271757970175
"D1/0_growth factor induced, enriched in nuclear receptor subfamily 4 (M94)",tPLS_Comp1,34,-0.4446571972210427,0.008418227279783587
D3/0_transcription regulation in cell development (M49),tPLS_Comp1,34,-0.44419182100643495,0.008495051230431873
D7/0_antiviral IFN signature (M75),tPLS_Comp1,34,-0.4435611459162447,0.00860011415438215
D3/0_cell division (stimulated CD4+ T cells) (M46),tPLS_Comp1,34,-0.44272621595217354,0.008740902381633959
D1/0_myeloid cell enriched receptors and transporters (M4.3),tPLS_Comp1,34,-0.44248194342158115,0.008782461054360377
D7/0_TBA (M66),tPLS_Comp1,34,-0.442232305608868,0.00882510601525135
D7/0_enriched in monocytes (I) (M4.15),tPLS_Comp1,34,-0.44221477053437497,0.008828108091575314
D7/0_enriched in T cells (I) (M7.0),tPLS_Comp1,34,0.4397244355162766,0.009263377515077545
D1/0_TBA (M246),tPLS_Comp1,34,0.4394869442484673,0.009305822815591424
D7/0_lysosomal/endosomal proteins (M139),tPLS_Comp1,34,-0.43934886225569775,0.009330577172668053
D1/0_TBA (M32.7),tPLS_Comp1,34,-0.4388144316842592,0.009426913776808085
D1/0_TBA (M194),tPLS_Comp1,34,0.43853039969985974,0.009478456190345534
D7/0_Activated (LPS) dendritic cell surface signature (S11),tPLS_Comp1,34,-0.4381212477860592,0.009553124088033025
D3/0_TBA (M241),tPLS_Comp1,34,0.4379041233509689,0.009592950391873077
D1/0_TBA (M93),tPLS_Comp1,34,-0.43784311339173065,0.009604166538500061
"D3/0_myeloid, dendritic cell activation via NFkB (II) (M43.1)",tPLS_Comp1,34,-0.43657345263282393,0.009840120665707275
D7/0_transcription regulation in cell development (M49),tPLS_Comp1,34,-0.43639292244696937,0.009874066305995074
D7/0_TBA (M32.6),tPLS_Comp1,34,-0.43623627518802366,0.009903601579526498
"D1/0_metabolism in mitochondria, peroxisome (M187)",tPLS_Comp1,34,0.4341403135649485,0.01030605061639277
D3/0_enriched in monocytes (surface) (M118.1),tPLS_Comp1,34,-0.43303317770257604,0.010524167285213073
D7/0_TBA (M41.3),tPLS_Comp1,34,-0.4313835556988069,0.010856401926056445
D1/0_respiratory electron transport chain (mitochondrion) (M219),tPLS_Comp1,34,-0.430562270585207,0.011025089988250884
D1/0_TBA (M229),tPLS_Comp1,34,-0.4291591182261778,0.011318419104005053
D1/0_formyl peptide receptor mediated neutrophil response (M11.2),tPLS_Comp1,34,-0.4282952111804609,0.011502278343096611
D1/0_leukocyte activation and migration (M45),tPLS_Comp1,34,0.42799011771993856,0.011567809110133536
D1/0_golgi membrane (I) (M113),tPLS_Comp1,34,-0.4270666167346854,0.011768091976100783
D3/0_viral sensing & immunity; IRF2 targets network (I) (M111.0),tPLS_Comp1,34,-0.4265390767132559,0.011883809447953378
D1/0_enriched for TF motif TNCATNTCCYR (M232),tPLS_Comp1,34,0.42640197988173056,0.011914038762866012
D1/0_complement activation (I) (M112.0),tPLS_Comp1,34,-0.426233602123735,0.01195125416483445
D1/0_TBA (M114.0),tPLS_Comp1,34,-0.4243298973321765,0.012378886380935693
D3/0_platelet activation (I) (M32.0),tPLS_Comp1,34,-0.4241669822323579,0.01241607390330533
D1/0_enriched in T cells (I) (M7.0),tPLS_Comp1,34,0.42345007734637,0.012580837851256674
D3/0_TBA (M105),tPLS_Comp1,34,-0.422825789240174,0.012725813045353904
D7/0_enriched in monocytes (surface) (M118.1),tPLS_Comp1,34,-0.421493129514503,0.013040003102985188
"D7/0_CCR1, 7 and cell signaling (M59)",tPLS_Comp1,34,-0.42094594358949233,0.013170886353009453
D1/0_cytoskeleton/actin (SRF transcription targets) (M145.1),tPLS_Comp1,34,-0.41992112541676635,0.01341899131409233
D1/0_mitotic cell division (M6),tPLS_Comp1,34,-0.4195373413328883,0.013512910295106042
D1/0_mitosis (TF motif CCAATNNSNNNGCG) (M169),tPLS_Comp1,34,0.41858493425345994,0.013748372553048959
D3/0_proinflammatory cytokines and chemokines (M29),tPLS_Comp1,34,-0.41736356819590975,0.014055367693399342
D7/0_TBA (M184.1),tPLS_Comp1,34,-0.4168389713479471,0.014188983914741864
D1/0_enriched for TF motif TTCNRGNNNNTTC (M172),tPLS_Comp1,34,-0.4163848211753542,0.01430551710145784
D1/0_Activated (LPS) dendritic cell surface signature (S11),tPLS_Comp1,34,-0.4142814240902789,0.01485577388133481
D7/0_mitotic cell division (M6),tPLS_Comp1,34,-0.4138295033229594,0.014976285776112035
D3/0_G protein coupled receptors cluster (M155),tPLS_Comp1,34,-0.41036290832767497,0.01592825118935218
D3/0_extracellular matrix (II) (M2.1),tPLS_Comp1,34,-0.4103509678927521,0.01593161565659347
D3/0_antiviral IFN signature (M75),tPLS_Comp1,34,-0.40798279759986167,0.016610758945726715
D1/0_transmembrane transport (SLC cluster) (M154.1),tPLS_Comp1,34,0.4079030702649664,0.016634037674538797
D3/0_CD4 T cell surface signature Th1-stimulated (S6),tPLS_Comp1,34,0.4072745830423925,0.016818499322498032
D7/0_TBA (M177.1),tPLS_Comp1,34,0.40609282049166934,0.01716997723880542
D3/0_platelet activation (II) (M32.1),tPLS_Comp1,34,-0.40600369334669734,0.017196732149644116
D7/0_enriched in G-protein coupled receptors (M130),tPLS_Comp1,34,0.40457029059949506,0.017631826936759677
D7/0_TBA (M26.2),tPLS_Comp1,34,-0.4038055560575089,0.017867686293442753
D1/0_TBA (M243),tPLS_Comp1,34,-0.4034630631720646,0.017974167741767355
D7/0_B cell surface signature (S2),tPLS_Comp1,34,0.4033547968682393,0.01800793772004134
D1/0_TBA (M218),tPLS_Comp1,34,0.40241833795307796,0.01830224763312018
D7/0_enriched in B cells (V) (M47.4),tPLS_Comp1,34,0.4006670114953039,0.018863413415216856
D3/0_regulation of antigen presentation and immune response (M5.0),tPLS_Comp1,34,-0.3993799274519911,0.019284894314949005
D1/0_glycerophospholipid metabolism (M114.1),tPLS_Comp1,34,-0.39925607695793924,0.019325861491233404
D1/0_proinflammatory cytokines and chemokines (M29),tPLS_Comp1,34,-0.3986005121687177,0.019543916251885243
D7/0_mitotic cell cycle (M4.7),tPLS_Comp1,34,-0.39825627845238043,0.01965923232501792
D1/0_B cell development/activation (M58),tPLS_Comp1,34,0.3981184705228794,0.019705555359246025
D7/0_TBA (M184.0),tPLS_Comp1,34,-0.3972097824783388,0.02001328049695675
D3/0_cell adhesion (lymphocyte homing) (M21),tPLS_Comp1,34,0.3966374134239489,0.020209153486384895
D7/0_TBA (M211),tPLS_Comp1,34,0.3948108504390707,0.02084490722353615
"D7/0_signal transduction, plasma membrane (M82)",tPLS_Comp1,34,-0.39367117365831156,0.0212499245914185
D3/0_enriched in T cells (I) (M7.0),tPLS_Comp1,34,0.3935349072474161,0.02129878454467196
D3/0_mitotic cell division (M6),tPLS_Comp1,34,-0.39287890317144236,0.021535307924803963
D7/0_TBA (M183),tPLS_Comp1,34,-0.3917519733929543,0.02194670433309674
D3/0_T cell activation (I) (M7.1),tPLS_Comp1,34,0.39143106414743906,0.02206503863844227
D7/0_extracellular region cluster (GO) (M189),tPLS_Comp1,34,-0.3911807260413449,0.02215771641732415
D7/0_TBA (M32.5),tPLS_Comp1,34,-0.39092531032723654,0.022252605868899215
D7/0_TBA (M114.0),tPLS_Comp1,34,-0.39001422099345845,0.022593828498544688
D1/0_TBA (M211),tPLS_Comp1,34,0.3899101471026977,0.02263308039373582
D1/0_putative targets of PAX3 (M89.0),tPLS_Comp1,34,-0.38968908285646797,0.02271664286503916
D1/0_spliceosome (M250),tPLS_Comp1,34,-0.388782772941164,0.02306190093196381
D1/0_putative targets of PAX3 (M89.1),tPLS_Comp1,34,-0.3877142460176698,0.023474515753103033
D1/0_transmembrane and ion transporters (II) (M224),tPLS_Comp1,34,0.3852756800014307,0.024439051866316057
D3/0_TBA (M192),tPLS_Comp1,34,-0.3830330326684769,0.025354728111744634
D1/0_mitotic cell cycle in stimulated CD4 T cells (M4.9),tPLS_Comp1,34,-0.38129895967655963,0.02608196761686495
"D3/0_proinflammatory dendritic cell, myeloid cell response (M86.1)",tPLS_Comp1,34,-0.381118087966639,0.026158800474630796
D1/0_cell adhesion (GO) (M117),tPLS_Comp1,34,-0.3791169943125241,0.027021343779938624
D7/0_double positive thymocytes (M126),tPLS_Comp1,34,0.3788769923783107,0.02712634464703307
D3/0_respiratory electron transport chain (mitochondrion) (M238),tPLS_Comp1,34,-0.378697489140855,0.02720509624652279
D7/0_TBA (M190),tPLS_Comp1,34,-0.3784862923553325,0.027297992804701996
D1/0_lysosome (M209),tPLS_Comp1,34,-0.3779254420956884,0.0275459524729114
D7/0_T cell surface signature (S0),tPLS_Comp1,34,0.37690136959614295,0.02800347961338348
D7/0_enriched for TF motif TNCATNTCCYR (M232),tPLS_Comp1,34,0.37677036211865195,0.028062457350716438
D7/0_mitotic cell cycle in stimulated CD4 T cells (M4.11),tPLS_Comp1,34,-0.3763297560131628,0.028261560255257556
D1/0_mitochondrial cluster (M235),tPLS_Comp1,34,0.3763191383019019,0.028266372489515232
D1/0_TBA (M98.0),tPLS_Comp1,34,0.3761451109985815,0.028345342204311615
D7/0_mitotic cell cycle in stimulated CD4 T cells (M4.5),tPLS_Comp1,34,-0.376000554197556,0.028411076348070684
"D1/0_receptors, cell migration (M109)",tPLS_Comp1,34,-0.3759592475656025,0.028429882610401684
D1/0_olfactory receptors (M228),tPLS_Comp1,34,0.3749303439788279,0.028901630213480606
D3/0_cell cycle and growth arrest (M31),tPLS_Comp1,34,-0.37412424123213234,0.029275689563495747
D7/0_TBA (M188),tPLS_Comp1,34,-0.3721826868533608,0.03019293430880819
"D3/0_extracellular matrix, complement (M140)",tPLS_Comp1,34,-0.3720909870230017,0.030236830580730487
D3/0_TBA (M80),tPLS_Comp1,34,0.3709937298999867,0.030766143225236343
"D1/0_proinflammatory dendritic cell, myeloid cell response (M86.1)",tPLS_Comp1,34,-0.37087933308477367,0.030821761031680613
D3/0_TBA (M26.2),tPLS_Comp1,34,0.3705085722177469,0.031002583708064517
D1/0_enriched in G-protein coupled receptors (M130),tPLS_Comp1,34,0.3703904062502229,0.03106039588612545
D3/0_Hox cluster VI (M107),tPLS_Comp1,34,0.3698446081191176,0.03132856926611628
D1/0_enriched in antigen presentation (III) (M95.1),tPLS_Comp1,34,-0.3697775389178067,0.03136165322142799
D1/0_CORO1A-DEF6 network (II) (M32.4),tPLS_Comp1,34,-0.36930209766020317,0.031596998193975954
D1/0_chemokines and receptors (M38),tPLS_Comp1,34,-0.3685309350627206,0.031981790671414566
D7/0_interferon alpha response (I) (M158.0),tPLS_Comp1,34,-0.3674902269444965,0.032507133583797566
D7/0_enriched in B cell differentiation (M123),tPLS_Comp1,34,-0.36736216593347143,0.03257226133957389
D7/0_integrin mediated leukocyte migration (M39),tPLS_Comp1,34,0.366086262567935,0.03322697356535451
D7/0_mitosis (TF motif CCAATNNSNNNGCG) (M169),tPLS_Comp1,34,0.36513700855436576,0.03372099211128816
D7/0_TBA (M194),tPLS_Comp1,34,0.3644478121858422,0.0340834026317707
D3/0_signaling in T cells (I) (M35.0),tPLS_Comp1,34,-0.36386392540940293,0.03439291068928531
D1/0_TBA (M221),tPLS_Comp1,34,0.36362707760502494,0.03451910945543292
D1/0_TBA (M236),tPLS_Comp1,34,0.363102778671139,0.03479980943325435
D7/0_cell cycle (III) (M103),tPLS_Comp1,34,-0.36218836378042274,0.03529380882506475
D1/0_mitotic cell cycle (M4.7),tPLS_Comp1,34,-0.36122698759662464,0.035819306141843706
D1/0_lysosomal/endosomal proteins (M139),tPLS_Comp1,34,-0.3604622420306446,0.036241844052763934
D1/0_cytokines - recepters cluster (M115),tPLS_Comp1,34,-0.3593101946279607,0.03688600130177812
"D1/0_collagen, TGFB family et al (M77)",tPLS_Comp1,34,0.3590666886268021,0.037023336734534354
D7/0_TBA (M236),tPLS_Comp1,34,0.3579506849099231,0.03765806631547856
D1/0_transmembrane and ion transporters (I) (M142),tPLS_Comp1,34,0.35730430213631226,0.03802971003406205
D1/0_enriched in calcium signaling proteins (M239),tPLS_Comp1,34,0.3570262276785474,0.038190502240477354
D1/0_complement and other receptors in DCs (M40),tPLS_Comp1,34,-0.3557095392654434,0.03895934419324469
D3/0_TBA (M32.6),tPLS_Comp1,34,-0.3551707212729045,0.039277558244471454
D1/0_TBA (source: B cells) (M217),tPLS_Comp1,34,0.3550021957246594,0.03937751588599807
D7/0_cytokines - recepters cluster (M115),tPLS_Comp1,34,-0.35483230583345654,0.039478490749611336
D7/0_enriched in B cells (VI) (M69),tPLS_Comp1,34,0.35439426077675795,0.039739810424217197
D3/0_chemokines and receptors (M38),tPLS_Comp1,34,-0.3539160023834053,0.04002671349806787
D7/0_complement activation (II) (M112.1),tPLS_Comp1,34,0.3539080556219861,0.04003149478033408
D7/0_CORO1A-DEF6 network (I) (M32.2),tPLS_Comp1,34,-0.35290357503995495,0.040639578794183215
D3/0_cell cycle (I) (M4.1),tPLS_Comp1,34,-0.3528874201492089,0.04064941905925934
D1/0_RIG-1 like receptor signaling (M68),tPLS_Comp1,34,-0.3527536144197548,0.04073099671989933
D1/0_metabolism of steroids (M225),tPLS_Comp1,34,0.35237993277717533,0.04095951985416163
"D1/0_plasma cells, immunoglobulins (M156.1)",tPLS_Comp1,34,0.3515761774137351,0.04145455733161625
D3/0_platelet activation (III) (M42),tPLS_Comp1,34,-0.35155543874241063,0.04146739393609074
D7/0_TBA (M93),tPLS_Comp1,34,-0.351447502961866,0.04153425463401148
"D3/0_metabolism in mitochondria, peroxisome (M187)",tPLS_Comp1,34,0.35110771750986575,0.04174530187998277
D7/0_respiratory electron transport chain (mitochondrion) (M219),tPLS_Comp1,34,-0.35051522101415833,0.0421153794537925
D3/0_TBA (M201),tPLS_Comp1,34,0.3483803808022934,0.04347078668191143
D7/0_TBA (M166),tPLS_Comp1,34,-0.34755706862103136,0.04400278721330693
D7/0_T cell differentiation (Th2) (M19),tPLS_Comp1,34,0.34735955085447046,0.0441311925044756
D3/0_leukocyte differentiation (M160),tPLS_Comp1,34,-0.3471863894789883,0.04424401135483979
D1/0_TBA (M207),tPLS_Comp1,34,0.34718603446975405,0.04424424288978312
D7/0_platelet activation (I) (M32.0),tPLS_Comp1,34,-0.345873682509362,0.045106828178761445
D3/0_myeloid cell enriched receptors and transporters (M4.3),tPLS_Comp1,34,-0.34538317836433574,0.04543267194959929
D3/0_TBA (M211),tPLS_Comp1,34,0.34399952733543754,0.046362023832507336
D3/0_T cell activation (II) (M7.3),tPLS_Comp1,34,0.34388904489603633,0.04643688313299532
D1/0_TBA (M177.0),tPLS_Comp1,34,0.34323357211458466,0.046883004436035505
