BTM,target,n,r,p_value
D3/0_cell cell adhesion (M133.1),tPLS_Comp1,34,0.34309493616420356,0.04697779981067977
D7/0_TBA (M203),tPLS_Comp1,34,0.34258622548968926,0.04732695771361961
D1/0_regulation of signal transduction (M3),tPLS_Comp1,34,-0.34234741181627343,0.047491584487987265
D7/0_RIG-1 like receptor signaling (M68),tPLS_Comp1,34,-0.3421784882254232,0.047608308890936424
D1/0_TBA (M66),tPLS_Comp1,34,-0.3421097004227607,0.04765590626123254
D1/0_Rho GTPase cycle (M4.14),tPLS_Comp1,34,-0.3416615278372187,0.0479669500382174
D1/0_innate antiviral response (M150),tPLS_Comp1,34,-0.3415144644311099,0.04806936912315003
D7/0_platelet activation (II) (M32.1),tPLS_Comp1,34,-0.3414734684699325,0.048097951015965826
D7/0_TBA (M218),tPLS_Comp1,34,0.34107052491663375,0.04837960241389854
D1/0_enriched in activated dendritic cells (I) (M119),tPLS_Comp1,34,-0.3410110696938789,0.04842127212204912
D1/0_G protein coupled receptors cluster (M155),tPLS_Comp1,34,-0.33993895543994335,0.04917760902234308
D3/0_TBA (M197),tPLS_Comp1,34,0.33930133292965986,0.04963188448332592
D1/0_E2F transcription factor network (M8),tPLS_Comp1,34,-0.3379214953000484,0.050626423944451486
D7/0_CD4 T cell surface signature Th2-stimulated (S7),tPLS_Comp1,34,0.3330923749623689,0.05423284231707686
"D3/0_muscle contraction, SRF targets (M195)",tPLS_Comp1,34,0.33206817443510567,0.055023330779395856
D7/0_nuclear pore complex (mitosis) (M106.1),tPLS_Comp1,34,0.3317217464725057,0.05529276741494701
D7/0_TBA (M104),tPLS_Comp1,34,0.3315370824460227,0.055436818208537436
D1/0_chromosome Y linked (M240),tPLS_Comp1,34,-0.33135733096091574,0.05557732266220755
D1/0_E2F1 targets (Q3) (M10.0),tPLS_Comp1,34,-0.3307121868792355,0.05608393324678233
D7/0_enriched in B cells (I) (M47.0),tPLS_Comp1,34,0.33070126700020863,0.05609253966980845
D1/0_T cell activation and signaling (M5.1),tPLS_Comp1,34,0.3293091176434693,0.05719835592413577
D7/0_enriched in T cells (II) (M223),tPLS_Comp1,34,0.328099818697231,0.05817287593042019
D1/0_TBA (M104),tPLS_Comp1,34,0.32796730582227046,0.05828045561631852
"D1/0_Membrane, ER proteins (M134)",tPLS_Comp1,34,0.3276985364636738,0.05849913738831726
D1/0_TBA (M108),tPLS_Comp1,34,-0.3270325207409423,0.05904383143064658
D1/0_mismatch repair (II) (M22.1),tPLS_Comp1,34,0.326949775015207,0.05911178312508656
D3/0_B cell development/activation (M58),tPLS_Comp1,34,0.32681879310264306,0.05921947321541111
D7/0_TBA (M192),tPLS_Comp1,34,-0.3252895627178436,0.06048827187055967
"D1/0_cell activation (IL15, IL23, TNF) (M24)",tPLS_Comp1,34,-0.32526636914759,0.060507679314441204
D3/0_TBA (source: B cells) (M152.0),tPLS_Comp1,34,0.32519641035593355,0.06056624776906067
D7/0_metabolism of steroids (M225),tPLS_Comp1,34,-0.32452547089929457,0.06113022244103039
D1/0_nuclear pore complex (mitosis) (M106.1),tPLS_Comp1,34,0.32391330107524335,0.06164840187636736
D3/0_enriched for TF motif TTCNRGNNNNTTC (M172),tPLS_Comp1,34,-0.32389065346054374,0.06166763844447614
D7/0_innate activation by cytosolic DNA sensing (M13),tPLS_Comp1,34,-0.3228666489000609,0.06254236703873564
D7/0_T cell activation (II) (M7.3),tPLS_Comp1,34,0.32281546002272393,0.0625863487940155
D3/0_cell junction (M162.1),tPLS_Comp1,34,0.3212340840956664,0.06395711211180902
D1/0_mitotic cell cycle in stimulated CD4 T cells (M4.11),tPLS_Comp1,34,-0.3208274655830232,0.06431336256202246
D1/0_TBA (M203),tPLS_Comp1,34,0.3208270039988186,0.06431376785378853
D3/0_integrin cell surface interactions (I) (M1.0),tPLS_Comp1,34,0.3204604052028774,0.06463629252108473
D7/0_TBA (M26.1),tPLS_Comp1,34,-0.3195888540371989,0.06540816370023261
D3/0_TBA (M174),tPLS_Comp1,34,0.3182132107098736,0.06664117613707018
D7/0_nuclear pore complex (M106.0),tPLS_Comp1,34,0.3179312783809186,0.0668961122683535
"D3/0_MAPK, RAS signaling (M100)",tPLS_Comp1,34,-0.3178671095851905,0.06695424328217602
D7/0_T cell activation (IV) (M52),tPLS_Comp1,34,0.3175487929467341,0.067243194346197993
D1/0_TBA (M41.1),tPLS_Comp1,34,0.3169672114914131,0.06777364577606604
D3/0_enriched for cell migration (M122),tPLS_Comp1,34,0.31636750195447944,0.06832405744989416
D7/0_leukocyte migration (M88.0),tPLS_Comp1,34,-0.3152845392221285,0.06932685444938917
D1/0_TBA (M128),tPLS_Comp1,34,-0.314995801601465,0.06959615187774769
D3/0_CORO1A-DEF6 network (I) (M32.2),tPLS_Comp1,34,-0.31461856715152126,0.06994921896836635
D1/0_Ran mediated mitosis (M15),tPLS_Comp1,34,-0.31394167566711667,0.07058625277405332
D1/0_integrin cell surface interactions (II) (M1.1),tPLS_Comp1,34,0.3133520786577984,0.07114481576251827
D3/0_TBA (M32.5),tPLS_Comp1,34,-0.31273742683739736,0.07173078108934497
D1/0_chaperonin mediated protein folding (I) (M204.0),tPLS_Comp1,34,0.31113858846936066,0.07327263625796254
D7/0_MHC-TLR7-TLR8 cluster (M146),tPLS_Comp1,34,-0.3109549275629922,0.07345139133109185
D1/0_signaling in T cells (I) (M35.0),tPLS_Comp1,34,-0.31040926110743094,0.07398448580858029
D7/0_TBA (M233),tPLS_Comp1,34,-0.3103367174111667,0.07405558428550461
D3/0_putative targets of PAX3 (M89.0),tPLS_Comp1,34,-0.3098878284846542,0.07449671349886451
D7/0_C-MYC transcriptional network (M4.12),tPLS_Comp1,34,-0.30758745333158166,0.07678948130852956
D3/0_T cell activation (III) (M7.4),tPLS_Comp1,34,0.3072875580928764,0.07709237551605208
"D3/0_myeloid, dendritic cell activation via NFkB (I) (M43.0)",tPLS_Comp1,34,-0.30704695904661494,0.07733605003098142
D7/0_interferon alpha response (II) (M158.1),tPLS_Comp1,34,-0.306997290540196,0.07738642773890261
D1/0_T cell activation (I) (M7.1),tPLS_Comp1,34,0.3062840368987983,0.07811267635445425
D1/0_cell development (M175),tPLS_Comp1,34,0.30550312159464055,0.07891386544453
D7/0_mitochondrial cluster (M235),tPLS_Comp1,34,0.3054087994295613,0.07901106553274666
"D7/0_plasma membrane, cell junction (M162.0)",tPLS_Comp1,34,-0.30540416657913405,0.07901584212660659
D7/0_TBA (M90),tPLS_Comp1,34,-0.30524208101971195,0.07918309752534186
D1/0_T cell activation (III) (M7.4),tPLS_Comp1,34,0.30501758860941564,0.07941520286916592
"D7/0_muscle contraction, SRF targets (M195)",tPLS_Comp1,34,-0.30405461479151746,0.08041681270761811
D1/0_enriched in plasma membrane proteins (II) (M135.1),tPLS_Comp1,34,0.30307158523983313,0.08144933109871233
D1/0_cell junction (M162.1),tPLS_Comp1,34,0.30260222850644586,0.08194591493930438
D3/0_integrin cell surface interactions (II) (M1.1),tPLS_Comp1,34,0.3020114225455589,0.08257431293263721
D3/0_TBA (M244),tPLS_Comp1,34,0.30091118810130996,0.08375445731500976
D3/0_AP-1 transcription factor network (M20),tPLS_Comp1,34,-0.29965313102836716,0.0851197726277245
D7/0_TBA (M108),tPLS_Comp1,34,-0.29950081296349984,0.0852862328474939
D7/0_antigen processing and presentation (M200),tPLS_Comp1,34,-0.29861704025348507,0.08625700987623407
D7/0_enriched in B cells (IV) (M47.3),tPLS_Comp1,34,0.2967657238165206,0.0883181054110364
D1/0_TBA (M170),tPLS_Comp1,34,0.29666748691040246,0.08842852061966529
D1/0_platelet activation (III) (M42),tPLS_Comp1,34,-0.2963046404975816,0.08883726708563706
D7/0_platelet activation (III) (M42),tPLS_Comp1,34,-0.29627468647416316,0.0888710749444813
D3/0_Hox cluster II (M17.1),tPLS_Comp1,34,0.29469043733738065,0.09067325608600403
D1/0_translation initiation (M227),tPLS_Comp1,34,0.2944317989735537,0.09097011149564745
D7/0_E2F1 targets (Q3) (M10.0),tPLS_Comp1,34,-0.29394820749008294,0.0915271551629205
D3/0_TBA (M98.0),tPLS_Comp1,34,0.2937698478537159,0.09173326316824897
"D7/0_receptors, cell migration (M109)",tPLS_Comp1,34,-0.2934820761198072,0.09206655346301602
D1/0_enriched in myeloid cells and monocytes (M81),tPLS_Comp1,34,-0.2934568015956308,0.09209586999046265
D1/0_chaperonin mediated protein folding (II) (M204.1),tPLS_Comp1,34,0.292614339585237,0.09307715286209983
D3/0_targets of FOSL1/2 (M0),tPLS_Comp1,34,-0.292461394717253,0.09325615356007821
D1/0_TBA (M184.1),tPLS_Comp1,34,-0.29244718486616644,0.09327279755681817
"D1/0_CCR1, 7 and cell signaling (M59)",tPLS_Comp1,34,-0.290598392258654,0.09545770731525711
D7/0_Wnt signaling pathway (M206),tPLS_Comp1,34,-0.2904284548494284,0.09566048134683719
D7/0_chaperonin mediated protein folding (I) (M204.0),tPLS_Comp1,34,0.2901300964493817,0.09601728489308337
D3/0_TBA (M180),tPLS_Comp1,34,-0.28571038259322357,0.1014223220287938
D3/0_TBA (M214),tPLS_Comp1,34,-0.2836732519812542,0.10398992234491437
D7/0_enriched in myeloid cells and monocytes (M81),tPLS_Comp1,34,-0.28330114359019504,0.10446419129531419
D1/0_BCR signaling (M54),tPLS_Comp1,34,0.2831277447298864,0.10468575377157575
D7/0_extracellular matrix (I) (M2.0),tPLS_Comp1,34,-0.2827693080737064,0.1051448763769983
D1/0_Memory B cell surface signature (S9),tPLS_Comp1,34,0.2823679859271121,0.10566073478000719
D1/0_TBA (M249),tPLS_Comp1,34,-0.2821963028740105,0.10588199855349228
D1/0_TBA (M184.0),tPLS_Comp1,34,-0.28164690715941076,0.10659240698094156
D1/0_enriched in T cells (II) (M223),tPLS_Comp1,34,0.2813699319713202,0.10695191684702261
"D7/0_extracellular matrix, collagen (M210)",tPLS_Comp1,34,-0.28118773217229764,0.10718890787575926
D1/0_nuclear pore complex (M106.0),tPLS_Comp1,34,0.28055788744105364,0.10801121158510925
D1/0_enriched for unknown TF motif CTCNANGTGNY (M62.1),tPLS_Comp1,34,0.2804392143085124,0.10816667799109582
D3/0_erythrocyte differentiation (M173),tPLS_Comp1,34,0.28019150138553545,0.10849173478124731
D7/0_Hox cluster VI (M107),tPLS_Comp1,34,0.28006439557510393,0.10865881247683286
D3/0_transcriptional targets of glucocorticoid receptor (M74),tPLS_Comp1,34,0.2798628501454866,0.10892413654025887
D7/0_enriched in antigen presentation (II) (M95.0),tPLS_Comp1,34,-0.27938507279718405,0.10955505430344668
D3/0_T cell differentiation (Th2) (M19),tPLS_Comp1,34,0.2786350328897957,0.1105510443761736
D7/0_TBA (M201),tPLS_Comp1,34,0.2782718222057004,0.11103579747569281
D7/0_amino acid metabolishm and transport (M154.0),tPLS_Comp1,34,-0.2781052575536534,0.11125863376947817
D3/0_enriched for unknown TF motif CTCNANGTGNY (M62.1),tPLS_Comp1,34,0.2771031893482886,0.11260633555891954
D3/0_respiratory electron transport chain (mitochondrion) (M231),tPLS_Comp1,34,-0.2769696892217222,0.1127868034059867
D3/0_small GTPase mediated signal transduction (M215),tPLS_Comp1,34,-0.2757188932542914,0.1144882089723579
D3/0_E2F1 targets (Q3) (M10.0),tPLS_Comp1,34,-0.2750946420321829,0.1153445115151885
D7/0_enriched in NK cells (KIR cluster) (M61.1),tPLS_Comp1,34,-0.27386035655024915,0.11705171511353166
D3/0_enriched in NK cells (I) (M7.2),tPLS_Comp1,34,0.2726506274343268,0.11874321370530855
D3/0_spliceosome (M250),tPLS_Comp1,34,-0.2726092321060365,0.11880141563744566
D1/0_amino acid metabolishm and transport (M154.0),tPLS_Comp1,34,0.2721785241658311,0.11940825594584176
D7/0_cell junction (GO) (M4.13),tPLS_Comp1,34,-0.27200763380820653,0.11964966932433231
D3/0_cell development (M175),tPLS_Comp1,34,0.2713455643566235,0.12058839932374767
D7/0_TBA (M153),tPLS_Comp1,34,-0.270979909769985,0.12110919770687453
D1/0_ATF targets network (M41.4),tPLS_Comp1,34,0.2670915457166571,0.1267514184049337
D7/0_TBA (M128),tPLS_Comp1,34,-0.2666661546771291,0.12738030690597285
D1/0_TBA (M121),tPLS_Comp1,34,0.26465077522155117,0.1303912426834866
D1/0_TBA (M197),tPLS_Comp1,34,0.2641974294136766,0.13107571558003198
D7/0_TBA (M32.7),tPLS_Comp1,34,-0.26404969557911045,0.1312993398907155
D3/0_Hox cluster V (M96),tPLS_Comp1,34,0.26343987104857736,0.13222541074538813
D3/0_cell cycle (II) (M4.10),tPLS_Comp1,34,-0.26325333948874463,0.132509634717451
D1/0_enriched in membrane proteins (M124),tPLS_Comp1,34,-0.26244459287971966,0.13374715960147807
D7/0_TBA (M193),tPLS_Comp1,34,0.2621298233221085,0.13423110670127592
D3/0_innate antiviral response (M150),tPLS_Comp1,34,-0.2620102807355062,0.13441523659176335
D1/0_enriched in NK cells (I) (M7.2),tPLS_Comp1,34,0.26197833163559986,0.1344644788457646
D1/0_cell cell adhesion (M133.1),tPLS_Comp1,34,0.2596770513238291,0.13804640664558904
"D3/0_Membrane, ER proteins (M134)",tPLS_Comp1,34,0.2594458272638523,0.13841013863479834
D1/0_G protein mediated calcium signaling (M159),tPLS_Comp1,34,-0.25916963550016187,0.13884552884790624
D7/0_enriched in NK cells (I) (M7.2),tPLS_Comp1,34,0.25790495433416455,0.14085201274612158
D3/0_T cell differentiation via ITK and PKC (M18),tPLS_Comp1,34,0.2578791747760623,0.14089313291975755
D3/0_TBA (M32.7),tPLS_Comp1,34,-0.257377412943484,0.14169522846953594
D7/0_transmembrane transport (II) (M191),tPLS_Comp1,34,-0.25715061113288135,0.1420588783937528
D3/0_TBA (M183),tPLS_Comp1,34,-0.2563415556576448,0.1433616628010649
D3/0_enriched in hepatocyte nuclear factors (I) (M88.1),tPLS_Comp1,34,0.2547641485527955,0.1459267426632406
D3/0_integrins and cell adhesion (M84),tPLS_Comp1,34,-0.2545972510735189,0.14620008458552036
D1/0_CD4 T cell surface signature Th1-stimulated (S6),tPLS_Comp1,34,0.2542042774367633,0.14684516319113322
"D3/0_IL2, IL7, TCR network (M65)",tPLS_Comp1,34,0.25328524468792185,0.14836187120929276
D3/0_TBA (M104),tPLS_Comp1,34,0.25107821160753474,0.1520506752403898
D7/0_B cell development/activation (M58),tPLS_Comp1,34,0.25079943678020156,0.1525213020505539
D3/0_TBA (M243),tPLS_Comp1,34,-0.24934309102908256,0.15499706891094067
D1/0_TBA (M120),tPLS_Comp1,34,-0.24858825602862866,0.15629165021262015
"D7/0_collagen, TGFB family et al (M77)",tPLS_Comp1,34,0.2478983374492959,0.15748171067083575
D1/0_T cell differentiation via ITK and PKC (M18),tPLS_Comp1,34,0.247597122722376,0.15800332961061436
D3/0_T cell surface signature (S0),tPLS_Comp1,34,0.2470447419935625,0.15896313254830038
D7/0_inositol phosphate metabolism (M129),tPLS_Comp1,34,0.24500782293606882,0.16253873749376793
D1/0_cell cycle (III) (M103),tPLS_Comp1,34,-0.24403411848459636,0.1642682342410747
D7/0_CD4 T cell surface signature Th1-stimulated (S6),tPLS_Comp1,34,0.24318698043069278,0.16578362659959492
D3/0_enriched in myeloid cells and monocytes (M81),tPLS_Comp1,34,-0.2427926095576903,0.16649249731337007
D3/0_xenobiotic metabolism (M164),tPLS_Comp1,34,0.2423848823051109,0.1672276542096866
D3/0_TBA (M148),tPLS_Comp1,34,-0.2414365236006412,0.16894657839223448
D1/0_enriched in antigen presentation (II) (M95.0),tPLS_Comp1,34,-0.24027667277472653,0.17106594757372823
"D1/0_cell cycle, mitotic phase (M230)",tPLS_Comp1,34,-0.24025923922159753,0.17109794743550225
D7/0_TBA (M177.0),tPLS_Comp1,34,0.23962411832007832,0.17226664434197456
D7/0_translation initiation (M227),tPLS_Comp1,34,0.23961037068387095,0.1722920043117179
D1/0_T cell activation (II) (M7.3),tPLS_Comp1,34,0.23932973315550027,0.17281027163491103
D3/0_TBA (M121),tPLS_Comp1,34,0.23901050638183705,0.17340115181497454
D3/0_enriched in monocytes (I) (M4.15),tPLS_Comp1,34,-0.23871219573132502,0.17395461490400313
D7/0_T cell differentiation (M14),tPLS_Comp1,34,0.23863196382413263,0.17410368529056694
D7/0_regulation of antigen presentation and immune response (M5.0),tPLS_Comp1,34,-0.23798361569193036,0.1753116462332309
D3/0_TBA (M203),tPLS_Comp1,34,0.23674132147166455,0.17764281886456165
"D1/0_T & B cell development, activation (M62.0)",tPLS_Comp1,34,0.23641197893834767,0.1782645000854553
D7/0_TBA (source: naive B cells) (M152.1),tPLS_Comp1,34,-0.23601705985194668,0.1790119970517933
D7/0_TBA (M242),tPLS_Comp1,34,-0.23583251390356055,0.1793620627086921
D1/0_TBA (M153),tPLS_Comp1,34,-0.23582729446605358,0.17937197051378873
"D3/0_myeloid cell cytokines, metallopeptidases and laminins (M78)",tPLS_Comp1,34,-0.23542743041080083,0.18013216521616282
D7/0_TBA (M125),tPLS_Comp1,34,-0.23490450301386784,0.18112975500667572
D3/0_CD4 T cell surface signature Th2-stimulated (S7),tPLS_Comp1,34,0.23478990164520702,0.18134890091970413
"D3/0_growth factor induced, enriched in nuclear receptor subfamily 4 (M94)",tPLS_Comp1,34,-0.23443773206145685,0.18202350789918315
D1/0_viral sensing & immunity; IRF2 targets network (I) (M111.0),tPLS_Comp1,34,-0.23426306625586502,0.18235874989139286
D1/0_cytoskeleton/actin (SRF transcription targets) (M145.0),tPLS_Comp1,34,-0.23351025501527514,0.18380863428250555
D1/0_TBA (M166),tPLS_Comp1,34,0.23305674773990337,0.18468598444937978
D3/0_respiratory electron transport chain (mitochondrion) (M216),tPLS_Comp1,34,-0.23267697172828203,0.1854229617411918
D3/0_TBA (source: memory B cells) (M152.2),tPLS_Comp1,34,0.23259610036236159,0.185580164355843
D3/0_cytoskeletal remodeling (enriched for SRF targets) (M34),tPLS_Comp1,34,0.23062583264922984,0.18943912014772193
D7/0_platelet activation & blood coagulation (M199),tPLS_Comp1,34,0.23047935557559393,0.189728240816609
"D7/0_nuclear pore, transport; mRNA splicing, processing (M143)",tPLS_Comp1,34,0.23034227956161715,0.18999908566419266
D7/0_TBA (M174),tPLS_Comp1,34,0.23006919148133848,0.19053948116183944
D3/0_cytoskeletal remodeling (M32.8),tPLS_Comp1,34,-0.2297528821893097,0.19116674987703391
D1/0_type I interferon response (M127),tPLS_Comp1,34,-0.22961313854570423,0.19144433391185
D3/0_Rho GTPase cycle (M4.14),tPLS_Comp1,34,-0.22950759446956026,0.19165417166062665
D3/0_TBA (M26.1),tPLS_Comp1,34,0.22944335517351705,0.19178196802495737
D3/0_cell division - E2F transcription network (M4.8),tPLS_Comp1,34,-0.22745395445860386,0.19576922110655012
D1/0_TBA (M190),tPLS_Comp1,34,-0.226909914011579,0.19686961263936803
D3/0_TBA (M170),tPLS_Comp1,34,0.22524957995241288,0.20025448981400984
D3/0_cell junction (GO) (M4.13),tPLS_Comp1,34,-0.22478496573367077,0.2012088861527599
D1/0_respiratory electron transport chain (mitochondrion) (M238),tPLS_Comp1,34,-0.22458660080596055,0.20161732207851416
D1/0_enriched in monocytes (I) (M4.15),tPLS_Comp1,34,-0.22451911415118225,0.20175640910406145
D3/0_E2F1 targets (Q4) (M10.1),tPLS_Comp1,34,-0.22344109530219766,0.20398719332023593
"D1/0_IL2, IL7, TCR network (M65)",tPLS_Comp1,34,0.22332652917057966,0.2042252697793353
D7/0_cytoskeletal remodeling (M32.8),tPLS_Comp1,34,-0.22301094899361976,0.20488206264235315
D1/0_inositol phosphate metabolism (M129),tPLS_Comp1,34,0.22167096470219488,0.2076871520554122
D3/0_TBA (M166),tPLS_Comp1,34,0.22080660545078626,0.2095105887355453
D3/0_TBA (M131),tPLS_Comp1,34,-0.22033048741784375,0.21051969961598802
D7/0_cell division - E2F transcription network (M4.8),tPLS_Comp1,34,-0.2202545740649375,0.2106809035238787
D7/0_TBA (M180),tPLS_Comp1,34,-0.21942969119588973,0.21243804590771667
D7/0_extracellular matrix (III) (M2.2),tPLS_Comp1,34,-0.2192800265944583,0.21275793423058725
D3/0_TBA (M188),tPLS_Comp1,34,0.21836852067925652,0.21471330844137126
D7/0_Rho GTPase cycle (M4.14),tPLS_Comp1,34,-0.21823759184226002,0.21499518840419826
D7/0_TBA (M70.0),tPLS_Comp1,34,-0.2172876461328943,0.21704795575660024
D3/0_PLK1 signaling events (M4.2),tPLS_Comp1,34,-0.21725740816859632,0.21711351760565
D1/0_phosphatidylinositol signaling system (M101),tPLS_Comp1,34,0.21724590388918014,0.21713846470582293
D7/0_TBA (M208),tPLS_Comp1,34,0.21686700819483062,0.21796119967207225
D3/0_enriched for SMAD2/3 signaling (M97),tPLS_Comp1,34,0.2136819725482444,0.22496157531106148
D3/0_TBA (M141),tPLS_Comp1,34,-0.21153414160563566,0.22976769814330456
D3/0_TBA (M90),tPLS_Comp1,34,0.2114864413400717,0.22987521845830533
D7/0_TBA (M170),tPLS_Comp1,34,-0.21111735797827166,0.23070831448799523
D7/0_chaperonin mediated protein folding (II) (M204.1),tPLS_Comp1,34,0.20938993923883376,0.23463459418760352
D1/0_TBA (source: naive B cells) (M152.1),tPLS_Comp1,34,0.20900881303415458,0.23550689298829577
D3/0_cell division (M37.3),tPLS_Comp1,34,-0.20843511358106878,0.2368240575496504
D3/0_chromosome Y linked (M240),tPLS_Comp1,34,-0.20798620404087675,0.23785816638926327
D3/0_TBA (M208),tPLS_Comp1,34,0.2078159569691674,0.23825114072724943
D3/0_TBA (source: B cells) (M217),tPLS_Comp1,34,0.20706649730129992,0.2399862754269841
D7/0_TBA (M229),tPLS_Comp1,34,-0.20599081384706175,0.24249146532029947
D1/0_chemokine cluster (I) (M27.0),tPLS_Comp1,34,-0.20588297673064837,0.24274357234296293
D3/0_Ran mediated mitosis (M15),tPLS_Comp1,34,-0.20576266171961227,0.24302505784526832
D7/0_TBA (M41.1),tPLS_Comp1,34,-0.2049534519511188,0.24492393676698967
"D7/0_cell adhesion, membrane (M133.0)",tPLS_Comp1,34,-0.20341836648820896,0.24855332151729523
D3/0_putative targets of PAX3 (M89.1),tPLS_Comp1,34,-0.20340920629053919,0.24857508578441867
D1/0_TBA (M174),tPLS_Comp1,34,0.20280974268274246,0.2500021473031113
D7/0_TBA (M70.1),tPLS_Comp1,34,-0.2026620488918636,0.2503545767372168
D3/0_chemokine cluster (I) (M27.0),tPLS_Comp1,34,-0.202242311715208,0.25135796340745314
D3/0_TBA (source: naive B cells) (M152.1),tPLS_Comp1,34,0.20156098942054892,0.25299235263174685
D7/0_transcriptional targets of glucocorticoid receptor (M74),tPLS_Comp1,34,-0.20148680913221126,0.2531707244444849
D1/0_enriched in extracellular matrix & associated proteins (M202),tPLS_Comp1,34,0.2006495763026768,0.2551896934991207
D3/0_inositol phosphate metabolism (M129),tPLS_Comp1,34,0.20063184200476514,0.25523257431604945
D7/0_T cell signaling and costimulation (M44),tPLS_Comp1,34,0.20056285020408668,0.2553994390761065
D3/0_TBA (M70.0),tPLS_Comp1,34,0.20024079267506242,0.25617932803398746
D3/0_C-MYC transcriptional network (M4.12),tPLS_Comp1,34,-0.1992757466735983,0.2585256898525794
D3/0_TBA (M149),tPLS_Comp1,34,0.19891006496205227,0.2594184823680715
D7/0_enriched in membrane proteins (M124),tPLS_Comp1,34,-0.19879094238083792,0.2597097523200057
D1/0_Hox cluster II (M17.1),tPLS_Comp1,34,0.1986962702041778,0.25994139160582413
D7/0_mismatch repair (I) (M22.0),tPLS_Comp1,34,0.19828417882783214,0.26095126286165016
D7/0_proteasome (M226),tPLS_Comp1,34,0.1977524681550703,0.26225808556767594
D1/0_Hox cluster V (M96),tPLS_Comp1,34,0.19752246031562554,0.26282472337534835
D1/0_small GTPase mediated signal transduction (M215),tPLS_Comp1,34,-0.19711841944859199,0.2638220490324489
D1/0_TBA (M72.2),tPLS_Comp1,34,0.19614594938869515,0.2662326515748838
D1/0_intracellular transport (M147),tPLS_Comp1,34,0.19608063740715906,0.26639506540161856
D1/0_xenobiotic metabolism (M164),tPLS_Comp1,34,0.1954117073801055,0.26806225669810696
D1/0_axon guidance (M110),tPLS_Comp1,34,0.1953831806646923,0.26813350596622104
D7/0_CD28 costimulation (M12),tPLS_Comp1,34,0.19454331907359465,0.27023672388463943
"D1/0_transcription elongation, RNA polymerase II (M234)",tPLS_Comp1,34,-0.19322784141260016,0.2735525915964833
D3/0_RIG-1 like receptor signaling (M68),tPLS_Comp1,34,-0.19319686298139646,0.27363099534219665
D7/0_spliceosome (M250),tPLS_Comp1,34,-0.19199677996534573,0.27667956108056574
D3/0_TBA (M26.0),tPLS_Comp1,34,0.1908337735220322,0.27965489211371314
D1/0_cell division (M37.3),tPLS_Comp1,34,0.19068347789706372,0.280040900058012
D3/0_enriched in calcium signaling proteins (M239),tPLS_Comp1,34,0.1895369983423378,0.2829967714290643
"D1/0_extracellular matrix, collagen (M210)",tPLS_Comp1,34,0.18910386432069368,0.28411870357161
D7/0_enriched for SMAD2/3 signaling (M97),tPLS_Comp1,34,-0.18883161635104906,0.284825363285322
D1/0_cell adhesion (lymphocyte homing) (M21),tPLS_Comp1,34,0.18755937880624257,0.2881426367950864
D7/0_TBA (M220),tPLS_Comp1,34,-0.18722182092949552,0.2890269429527334
D7/0_purine nucleotide biosynthesis (M212),tPLS_Comp1,34,0.18715020417686187,0.2892147822251104
"D3/0_cell adhesion, membrane (M133.0)",tPLS_Comp1,34,0.18678694128007794,0.29016876827547594
"D7/0_cell cycle, ATP binding (M144)",tPLS_Comp1,34,0.18587074577509227,0.29258378975748695
D3/0_TBA (M248),tPLS_Comp1,34,-0.18574795163379376,0.29290843948526346
D7/0_E2F1 targets (Q4) (M10.1),tPLS_Comp1,34,-0.18520729884489584,0.29434058394762835
D1/0_translation initiation factor 3 complex (M245),tPLS_Comp1,34,-0.18507565612409665,0.29468997008973896
"D3/0_T & B cell development, activation (M62.0)",tPLS_Comp1,34,0.18458859191891996,0.29598496198023805
D3/0_CORO1A-DEF6 network (II) (M32.4),tPLS_Comp1,34,-0.18427128517409466,0.2968305557036994
D1/0_TBA (M244),tPLS_Comp1,34,0.18304643559502526,0.3001090842277637
D1/0_extracellular region cluster (GO) (M189),tPLS_Comp1,34,0.18233971236647514,0.3020111718726459
D3/0_enriched in plasma membrane proteins (II) (M135.1),tPLS_Comp1,34,0.18231510809743112,0.302077529539381
D7/0_TBA (M207),tPLS_Comp1,34,-0.18187133237933026,0.30327597762822267
D7/0_cell adhesion (M51),tPLS_Comp1,34,-0.18137972944926975,0.3046070945563756
D1/0_erythrocyte differentiation (M173),tPLS_Comp1,34,0.18111132743542713,0.3053354047364856
D3/0_TBA (M137),tPLS_Comp1,34,0.18039217170314023,0.30729225417742695
"D1/0_cell cycle, ATP binding (M144)",tPLS_Comp1,34,0.180205908500975,0.307800369397746
D1/0_respiratory electron transport chain (mitochondrion) (M216),tPLS_Comp1,34,-0.17935651314092618,0.3101241780777601
D3/0_leukocyte activation and migration (M45),tPLS_Comp1,34,0.1775889509681352,0.3149951996634656
D3/0_transmembrane and ion transporters (II) (M224),tPLS_Comp1,34,0.17720617937671027,0.3160563067799103
D7/0_enriched for promoter motif NATCACGTGAY (putative SREBF1 targets) (M178),tPLS_Comp1,34,0.17615244830518648,0.31898895242898767
"D3/0_transcription elongation, RNA polymerase II (M234)",tPLS_Comp1,34,-0.17534761363199927,0.3212402784495331
D3/0_enriched in T cells (II) (M223),tPLS_Comp1,34,0.17515289307322238,0.3217864419152623
D3/0_leukocyte migration (M88.0),tPLS_Comp1,34,0.17311896111378314,0.3275257966834293
"D1/0_T cell surface, activation (M36)",tPLS_Comp1,34,-0.17308154232128425,0.32763197412605916
D7/0_BCR signaling (M54),tPLS_Comp1,34,0.1724516989517673,0.3294223734622367
D1/0_enriched in DNA interacting proteins (M182),tPLS_Comp1,34,0.17098001993331785,0.33362925618637185
D1/0_TBA (M72.1),tPLS_Comp1,34,0.16970213652492258,0.33730880277961184
D7/0_respiratory electron transport chain (mitochondrion) (M238),tPLS_Comp1,34,-0.16929107195579574,0.33849768373595046
D3/0_mismatch repair (I) (M22.0),tPLS_Comp1,34,-0.1690923212865362,0.3390734278865125
D1/0_TBA (M205),tPLS_Comp1,34,0.16825999535788172,0.3414910161197845
D7/0_TBA (M41.0),tPLS_Comp1,34,-0.16815777479667612,0.34178865020599014
D1/0_TBA (M99),tPLS_Comp1,34,0.16809600674124783,0.34196857591234064
D1/0_complement activation (II) (M112.1),tPLS_Comp1,34,0.1680832139322959,0.34200584761475983
D1/0_enriched in plasma membrane proteins (I) (M135.0),tPLS_Comp1,34,0.16744640920871956,0.34386429724944234
