BTM,target,n,r,p_value
D3/0_TBA (M141),outcome,34,0.11198052067898201,0.5283558513387885
D7/0_TBA (M177.0),outcome,34,0.11177660847488576,0.5291118334686691
D1/0_B cell development/activation (M58),outcome,34,0.1116119816795766,0.5297225513202263
D1/0_complement activation (II) (M112.1),outcome,34,0.11144086274135338,0.5303577145651432
D1/0_TBA (M193),outcome,34,-0.11140949410563462,0.5304741893239
D3/0_NK cell surface signature (S1),outcome,34,-0.11104374710420428,0.5318331551237123
D3/0_transmembrane and ion transporters (I) (M142),outcome,34,0.11053807011363737,0.5337148055409078
D1/0_TLR and inflammatory signaling (M16),outcome,34,-0.11003952821638016,0.5355730356762576
"D3/0_myeloid, dendritic cell activation via NFkB (I) (M43.0)",outcome,34,0.10957007578867022,0.5373256723256026
D1/0_TBA (source: B cells) (M217),outcome,34,0.10941737592044694,0.5378963473227638
D1/0_enriched in monocytes (III) (M73),outcome,34,-0.1091366791682004,0.5389461317382791
D7/0_enriched for ubiquitination (M138),outcome,34,0.10912051050567445,0.5390066310724815
D3/0_CORO1A-DEF6 network (I) (M32.2),outcome,34,-0.10875003962755073,0.5403937332377963
D3/0_TBA (M236),outcome,34,-0.10852708964420431,0.5412293120810654
D7/0_TBA (M193),outcome,34,0.10849211677796387,0.5413604402025752
"D7/0_cell adhesion, membrane (M133.0)",outcome,34,0.10823296437535156,0.5423325830155556
D7/0_mitotic cell cycle (M4.7),outcome,34,-0.10813134699602611,0.5427140002581191
D3/0_nuclear pore complex (mitosis) (M106.1),outcome,34,-0.10813112048015419,0.5427148506196009
D1/0_leukocyte activation and migration (M45),outcome,34,0.1080886781607677,0.5428741941588549
D3/0_TBA (M180),outcome,34,-0.1079329537281048,0.543459029012567
D1/0_Ran mediated mitosis (M15),outcome,34,0.10782852511312364,0.5438513857458003
D7/0_axon guidance (M110),outcome,34,0.1072187695682599,0.5461450200811302
D1/0_enriched for unknown TF motif CTCNANGTGNY (M62.1),outcome,34,0.10675862759637572,0.5478788902735423
D7/0_enriched in NK cells (III) (M157),outcome,34,0.10675803599569489,0.5478811211624929
D1/0_TBA (M246),outcome,34,0.10662760018370548,0.548373090770047
D7/0_antigen presentation (lipids and proteins) (M28),outcome,34,-0.10637126516259517,0.5493405240418955
D3/0_amino acid metabolishm and transport (M154.0),outcome,34,0.10627506749056703,0.5497037901118498
D1/0_extracellular matrix (III) (M2.2),outcome,34,0.10604253379891027,0.5505823598790249
D1/0_intracellular transport (M147),outcome,34,0.10564031897234114,0.552103578722418
D1/0_enriched in monocytes (IV) (M118.0),outcome,34,-0.10527284007720662,0.5534951381161232
D7/0_TBA (M32.5),outcome,34,-0.10504523769663687,0.5543578365148418
D3/0_TBA (M205),outcome,34,0.10503077503328906,0.5544126765936939
D1/0_platelet activation (II) (M32.1),outcome,34,-0.10447896001543018,0.556506955213213
"D1/0_transcription elongation, RNA polymerase II (M234)",outcome,34,0.10386305460393042,0.558848801324012
D3/0_type I interferon response (M127),outcome,34,-0.10352310404650744,0.5601433382008814
D3/0_enriched in nuclear pore complex interacting proteins (M247),outcome,34,-0.10305105924155321,0.561943183614261
D1/0_enriched in myeloid cells and monocytes (M81),outcome,34,-0.10250464524571733,0.5640299060679138
D7/0_E2F transcription factor network (M8),outcome,34,-0.10208592487575471,0.5656313750721124
D1/0_TBA (M201),outcome,34,-0.10189322511164896,0.5663690870112148
D1/0_chemokine cluster (II) (M27.1),outcome,34,0.10177960871899233,0.5668042501829728
D1/0_enriched in B cell differentiation (M123),outcome,34,-0.1014993948883224,0.5678781516242768
D7/0_myeloid cell enriched receptors and transporters (M4.3),outcome,34,-0.10077766445907947,0.5706483977092904
D1/0_TBA (M220),outcome,34,-0.10065302714633885,0.571127417883137
D1/0_enriched in monocytes (I) (M4.15),outcome,34,-0.10048873115387974,0.5717591370661717
D7/0_cell cell adhesion (M133.1),outcome,34,0.10027638573397296,0.5725760749381059
D3/0_cell cycle (I) (M4.1),outcome,34,-0.10027482500848066,0.5725820813332645
D1/0_interferon alpha response (I) (M158.0),outcome,34,-0.09928017475169698,0.5764157369107825
D1/0_enriched in T cells (I) (M7.0),outcome,34,0.0991255532856878,0.5770127243226089
D1/0_myeloid cell enriched receptors and transporters (M4.3),outcome,34,-0.0990097923027174,0.5774598544624104
D1/0_golgi membrane (II) (M237),outcome,34,0.09895524512470734,0.5776705983480772
D1/0_cell cycle and transcription (M4.0),outcome,34,-0.09892201609989205,0.5777989961056793
"D1/0_proinflammatory dendritic cell, myeloid cell response (M86.1)",outcome,34,-0.09863887046674513,0.5788935960955208
D3/0_leukocyte activation and migration (M45),outcome,34,-0.09840534935644044,0.579797052145971
D3/0_CD4 T cell surface signature Th2-stimulated (S7),outcome,34,0.09836448338976436,0.579955220788293
D3/0_axon guidance (M110),outcome,34,-0.09827818819711097,0.5802892830985804
D1/0_TBA (M26.0),outcome,34,-0.09790797795927031,0.5817233986651855
D7/0_G protein mediated calcium signaling (M159),outcome,34,0.09784660976178197,0.581961278320186
D7/0_CD4 T cell surface signature Th1-stimulated (S6),outcome,34,-0.09778834355352983,0.5821871738744504
D3/0_mitosis (TF motif CCAATNNSNNNGCG) (M169),outcome,34,-0.09749406511579409,0.5833286739575284
D7/0_enriched for unknown TF motif CTCNANGTGNY (M62.1),outcome,34,0.09748025086662376,0.5833822835521079
D1/0_BCR signaling (M54),outcome,34,0.09705957340949746,0.5850158720675479
D7/0_cytoskeleton/actin (SRF transcription targets) (M145.1),outcome,34,0.09645960991014228,0.5873491654820767
D3/0_viral sensing & immunity; IRF2 targets network (I) (M111.0),outcome,34,-0.09645123819503527,0.5873817525712446
D3/0_platelet activation (I) (M32.0),outcome,34,-0.09629847946586882,0.5879765092250526
D3/0_TBA (M128),outcome,34,0.09574642904261281,0.5901280903216025
D1/0_inositol phosphate metabolism (M129),outcome,34,0.09548366748439965,0.5911533980197692
"D1/0_extracellular matrix, collagen (M210)",outcome,34,0.09538596589997407,0.5915348328946932
D3/0_enriched for TF motif TNCATNTCCYR (M232),outcome,34,-0.09524029580427174,0.5921037405645064
D7/0_platelet activation and degranulation (M85),outcome,34,-0.09503951871194367,0.5928882576739729
D1/0_TBA (M188),outcome,34,-0.0949267958993739,0.5933289099304209
D7/0_TBA (M148),outcome,34,0.09465207993834529,0.5944034180754837
D3/0_cytokines - recepters cluster (M115),outcome,34,0.09459961921810722,0.5946087061783252
D1/0_T cell signaling and costimulation (M44),outcome,34,-0.09429836931581012,0.595788147150327
D7/0_TBA (M120),outcome,34,0.09429485978817605,0.5958018934891449
D1/0_TBA (M166),outcome,34,0.09401722850471117,0.5968897731704748
"D3/0_IL2, IL7, TCR network (M65)",outcome,34,0.09348304485992971,0.5989853532519618
D1/0_T cell activation (II) (M7.3),outcome,34,0.09325778400477235,0.5998699930262112
D7/0_innate antiviral response (M150),outcome,34,-0.09246655455416979,0.6029817447106072
D1/0_enriched for TF motif PAX3 (M179),outcome,34,0.09218924361721047,0.6040739891325608
D3/0_cell division - E2F transcription network (M4.8),outcome,34,-0.09217805639769378,0.604118069976717
D1/0_innate antiviral response (M150),outcome,34,-0.09200474682471343,0.6048011348775926
D3/0_T cell activation (I) (M7.1),outcome,34,0.09143516708062792,0.6070483383455142
D7/0_TBA (M141),outcome,34,-0.09125976828280946,0.6077410660724087
D1/0_TBA (M170),outcome,34,0.09103181121994763,0.6086418710503843
D3/0_platelet activation (III) (M42),outcome,34,-0.0907521624728071,0.6097477156039263
D7/0_cell division (stimulated CD4+ T cells) (M46),outcome,34,-0.09075039544646683,0.6097547058448778
D3/0_CD28 costimulation (M12),outcome,34,0.0907262944922954,0.6098500510325833
"D1/0_signal transduction, plasma membrane (M82)",outcome,34,-0.0907250198445385,0.6098550938105967
D3/0_transmembrane and ion transporters (II) (M224),outcome,34,0.0898767722362616,0.6132148445353407
D1/0_cytoskeletal remodeling (enriched for SRF targets) (M34),outcome,34,-0.08974797957017566,0.6137256478722453
D3/0_TBA (M193),outcome,34,0.0896163527426994,0.6142478762849886
D3/0_TBA (M186),outcome,34,0.0893203651217431,0.6154228851561327
D1/0_heme biosynthesis (I) (M171),outcome,34,-0.08915158017128472,0.6160933469796469
"D7/0_T cell surface, activation (M36)",outcome,34,-0.08858641520745283,0.6183405619885225
D3/0_enriched in NK cells (I) (M7.2),outcome,34,-0.08846675785994984,0.6188167821029752
D1/0_TBA (M98.0),outcome,34,0.08764101006463651,0.6221072945038523
D1/0_TBA (M104),outcome,34,0.08738760173324008,0.6231185460144666
D1/0_cell division (M37.3),outcome,34,0.08728384553367512,0.6235327910887243
D3/0_T cell activation (III) (M7.4),outcome,34,0.08705823441494868,0.6244339314238649
D3/0_enriched in monocytes (I) (M4.15),outcome,34,-0.08704401230390582,0.6244907556013124
D1/0_viral sensing & immunity; IRF2 targets network (I) (M111.0),outcome,34,0.08703574789994803,0.6245237768489467
D7/0_cell development (M175),outcome,34,0.08697189654433965,0.6247789254876364
D3/0_myeloid cell enriched receptors and transporters (M4.3),outcome,34,-0.08688283838584042,0.6251348714989093
D1/0_enriched in NK cells (II) (M61.0),outcome,34,0.08683443543721744,0.6253283624431494
D3/0_TBA (M233),outcome,34,0.08665112189870308,0.6260613816806349
D1/0_TBA (M177.0),outcome,34,0.08664066067603646,0.6261032237888089
D3/0_extracellular matrix (II) (M2.1),outcome,34,-0.08656681098821062,0.6263986355014943
D1/0_platelet activation (I) (M32.0),outcome,34,-0.08619454214020897,0.6278886446776557
D7/0_mitotic cell division (M6),outcome,34,-0.08606944076520964,0.6283896887816249
D1/0_Hox cluster V (M96),outcome,34,0.08573280523955655,0.6297387586369727
D3/0_TBA (M153),outcome,34,0.08545474915124268,0.630853958798159
D1/0_enriched in monocytes (surface) (M118.1),outcome,34,-0.08452892787375185,0.6345729148704258
D1/0_extracellular matrix (I) (M2.0),outcome,34,0.08451311687488412,0.6346365031749186
D7/0_regulation of antigen presentation and immune response (M5.0),outcome,34,-0.08443288474740208,0.6349592184261621
D1/0_TBA (M90),outcome,34,-0.08422597886743792,0.6357917543975569
D1/0_E2F1 targets (Q4) (M10.1),outcome,34,-0.08417035223508723,0.6360156564643709
D7/0_cell adhesion (lymphocyte homing) (M21),outcome,34,0.08392426406031486,0.637006562731945
D3/0_erythrocyte differentiation (M173),outcome,34,0.0839158057767368,0.6370406321214169
D1/0_TBA (M184.1),outcome,34,-0.08324943411433681,0.6397270230787886
D1/0_complement activation (I) (M112.0),outcome,34,-0.08276160211484307,0.6416965128607239
D1/0_type I interferon response (M127),outcome,34,-0.08252939785985801,0.6426348197138223
D7/0_amino acid metabolishm and transport (M154.0),outcome,34,-0.08252747078751549,0.6426426090345423
D1/0_CD4 T cell surface signature Th2-stimulated (S7),outcome,34,-0.08201482900777653,0.6447160589580689
D3/0_enriched in cell cycle (M167),outcome,34,0.08170602903367415,0.6459663151432705
D7/0_enriched in plasma membrane proteins (II) (M135.1),outcome,34,-0.08153574229724708,0.6466561727133417
D1/0_mitotic cell cycle (M4.7),outcome,34,0.08150914317510226,0.6467639559578838
D3/0_DNA repair (M76),outcome,34,-0.08072612132900467,0.6499400204273548
D7/0_TBA (M41.0),outcome,34,-0.08036313175005692,0.6514144268802758
D7/0_platelet activation (III) (M42),outcome,34,-0.08023876090241147,0.6519199007456449
D3/0_TBA (M218),outcome,34,-0.08009122741531667,0.652519710817162
D1/0_respiratory electron transport chain (mitochondrion) (M238),outcome,34,0.07922342331130622,0.6560521644811852
D1/0_enriched for cell migration (M122),outcome,34,-0.07920678111512709,0.6561199795706973
D3/0_TBA (M32.6),outcome,34,-0.07892038467339883,0.6572874355086584
"D1/0_receptors, cell migration (M109)",outcome,34,-0.07877371724740337,0.6578856139004059
D3/0_TBA (M70.1),outcome,34,0.07850467167033552,0.6589834498839681
D3/0_interferon alpha response (II) (M158.1),outcome,34,0.0783805875536538,0.6594900090944515
D1/0_nucleotide metabolism (M181),outcome,34,-0.07757308519377122,0.6627901698140879
"D1/0_nuclear pore, transport; mRNA splicing, processing (M143)",outcome,34,0.07736200992395041,0.6636538396935523
D1/0_RIG-1 like receptor signaling (M68),outcome,34,-0.07709967436643828,0.6647278477763074
D1/0_PLK1 signaling events (M4.2),outcome,34,-0.07697733834129059,0.6652289187318151
D1/0_cytoskeletal remodeling (M32.8),outcome,34,-0.07691877512055342,0.6654688357728289
"D1/0_T cell surface, activation (M36)",outcome,34,0.07691135455219622,0.665499238082658
D3/0_TBA (M41.0),outcome,34,0.07665966145858556,0.6665307426907353
D7/0_cell cycle (III) (M103),outcome,34,-0.07661838552373665,0.6666999597306624
D1/0_spliceosome (M250),outcome,34,-0.07640363767549821,0.6675806119720558
D3/0_interferon alpha response (I) (M158.0),outcome,34,0.07624118277918708,0.6682471076178691
D1/0_endoplasmic reticulum (M37.2),outcome,34,-0.0762314846141702,0.6682869036835462
D1/0_TBA (M41.1),outcome,34,0.07589792250643065,0.6696562033568934
D3/0_enriched for ubiquitination (M138),outcome,34,0.07555917082479915,0.6710478775890479
D3/0_TBA (M72.1),outcome,34,-0.07553618374162986,0.6711423531140104
D1/0_small GTPase mediated signal transduction (M215),outcome,34,-0.07532317587602558,0.6720180378626073
D1/0_TBA (M243),outcome,34,0.0751731716848646,0.6726349662134672
D1/0_TBA (M242),outcome,34,-0.07510920634885447,0.6728981029220198
D7/0_chemokine cluster (II) (M27.1),outcome,34,-0.07508859920637322,0.672982883456382
D1/0_T cell activation (IV) (M52),outcome,34,-0.07504871240157002,0.6731469943385271
D1/0_TBA (M72.2),outcome,34,0.07504014223229029,0.6731822575092985
D3/0_TBA (M72.2),outcome,34,-0.07496799264558371,0.6734791542839128
"D3/0_cell cycle, ATP binding (M144)",outcome,34,-0.07416237030464849,0.6767975859059729
D7/0_TBA (M166),outcome,34,-0.0739486679117003,0.6776788523188109
D3/0_AP-1 transcription factor network (M20),outcome,34,-0.07371329135736739,0.6786499849316119
D3/0_TBA (M243),outcome,34,0.07324921878274608,0.6805661751222796
D7/0_CORO1A-DEF6 network (I) (M32.2),outcome,34,-0.07299069072964529,0.6816345099013912
"D3/0_regulation of transcription, transcription factors (M213)",outcome,34,0.07294732321491283,0.6818137803400905
D1/0_TBA (M120),outcome,34,-0.07281944497062791,0.6823424965112207
D7/0_TBA (M244),outcome,34,0.07271069980478613,0.6827922232869506
D1/0_translation initiation factor 3 complex (M245),outcome,34,-0.07245230629437302,0.6838612660971752
D1/0_TBA (M136),outcome,34,-0.07221565085987375,0.6848409024395804
D3/0_T cell signaling and costimulation (M44),outcome,34,-0.07199917919469555,0.6857374302612138
D1/0_TBA (M70.0),outcome,34,-0.07195485188213473,0.6859210659851447
D1/0_TBA (M98.1),outcome,34,-0.07194215675738526,0.6859736616093945
D1/0_cell junction (M162.1),outcome,34,0.0718641560117484,0.6862968487779344
"D3/0_nuclear pore, transport; mRNA splicing, processing (M143)",outcome,34,0.0717644895124812,0.6867098850180695
D3/0_enriched in NK cells (III) (M157),outcome,34,0.07122526831167884,0.6889460587766193
D3/0_targets of FOSL1/2 (M0),outcome,34,-0.07102334076678264,0.6897841288303634
D1/0_double positive thymocytes (M126),outcome,34,0.0709333879737813,0.6901575811918929
D3/0_proinflammatory cytokines and chemokines (M29),outcome,34,-0.07076439761771705,0.6908593639518676
D1/0_TBA (M184.0),outcome,34,-0.0707297155131726,0.6910034230323623
D3/0_extracellular region cluster (GO) (M189),outcome,34,0.07018006255053982,0.6932879365042275
D3/0_Wnt signaling pathway (M206),outcome,34,0.07009099409354679,0.6936583810124193
D7/0_TBA (M243),outcome,34,0.07006268057887324,0.6937761543254338
"D7/0_cell movement, Adhesion & Platelet activation (M30)",outcome,34,-0.06978955107910781,0.6949126291611192
D3/0_spliceosome (M250),outcome,34,0.06971526684743191,0.6952218343103173
D3/0_mismatch repair (II) (M22.1),outcome,34,-0.06951849572453894,0.6960411194496996
D1/0_TBA (M185),outcome,34,0.06951361717059125,0.6960614363136584
D3/0_purine nucleotide biosynthesis (M212),outcome,34,0.0691425228124649,0.6976074762298585
D7/0_enriched in plasma membrane proteins (I) (M135.0),outcome,34,0.06905356975245179,0.6979782472061242
D1/0_enriched in plasma membrane proteins (II) (M135.1),outcome,34,0.06873045647778953,0.699325613526667
D7/0_TBA (M70.1),outcome,34,-0.06791927922548904,0.7027121499383653
D7/0_cell junction (GO) (M4.13),outcome,34,-0.0676730307465283,0.7037413145474678
D3/0_proteasome (M226),outcome,34,-0.06758161471200821,0.7041235080684827
"D1/0_plasma cells & B cells, immunoglobulins (M156.0)",outcome,34,0.06742701199960645,0.7047700353061906
D1/0_TBA (M149),outcome,34,-0.06732408754505313,0.7052005638540555
D1/0_T cell differentiation (Th2) (M19),outcome,34,-0.06729426757160492,0.7053253163194408
D3/0_viral sensing & immunity; IRF2 targets network (II) (M111.1),outcome,34,-0.06721312350402664,0.7056648223654164
D1/0_DC surface signature (S5),outcome,34,-0.06710901587091705,0.7061004894843497
D1/0_enriched in T cells (II) (M223),outcome,34,0.06684585520459824,0.7072021666582708
D1/0_cell adhesion (M51),outcome,34,-0.06673726564786125,0.7076569286564238
D1/0_CORO1A-DEF6 network (I) (M32.2),outcome,34,-0.06668809869547092,0.707862867517802
D3/0_TBA (M242),outcome,34,0.066518484658464,0.708573462642015
D1/0_TBA (M137),outcome,34,0.06646441086000737,0.7088000547222582
D1/0_TBA (M32.6),outcome,34,-0.06646186511066121,0.7088107230934831
D1/0_TBA (M208),outcome,34,0.06638301589775927,0.709141180298102
D7/0_TBA (M184.0),outcome,34,-0.06619843321594057,0.7099149704162455
D7/0_enriched in DNA interacting proteins (M182),outcome,34,0.06547400848654965,0.7129545826213879
D1/0_TBA (M148),outcome,34,0.0649859497099836,0.7150048808203519
D7/0_T cell activation (II) (M7.3),outcome,34,0.06447149728476015,0.7171681784492185
D1/0_mitotic cell cycle in stimulated CD4 T cells (M4.11),outcome,34,0.06397774939571371,0.7192464464805826
D1/0_Hox cluster III (M17.2),outcome,34,0.0639104919038181,0.7195296980068087
D7/0_cytoskeletal remodeling (enriched for SRF targets) (M34),outcome,34,-0.06337102657825557,0.7218029530020031
D1/0_ATF targets network (M41.4),outcome,34,0.06325233961785985,0.722303403371187
D7/0_TBA (M121),outcome,34,0.06315499181131425,0.7227139604661921
D7/0_spliceosome (M250),outcome,34,0.06290597510582473,0.7237645155619213
D1/0_Monocyte surface signature (S4),outcome,34,-0.06262543709261514,0.7249486469775968
D7/0_cell division (M37.3),outcome,34,0.06243885989943305,0.7257365234900905
D1/0_platelet activation - actin binding (M196),outcome,34,-0.0624100445616156,0.7258582293084057
D3/0_respiratory electron transport chain (mitochondrion) (M219),outcome,34,-0.06170423641592326,0.7288413654282108
D7/0_enriched in nuclear pore complex interacting proteins (M247),outcome,34,0.061346546871239416,0.7303546568313224
D7/0_interferon alpha response (I) (M158.0),outcome,34,0.06100213439948732,0.7318127217281036
"D1/0_cell cycle, ATP binding (M144)",outcome,34,0.06096567858125991,0.7319671109594929
D7/0_respiratory electron transport chain (mitochondrion) (M238),outcome,34,0.059727100784892816,0.7372185514425258
D3/0_chemokine cluster (I) (M27.0),outcome,34,-0.059664665787401205,0.7374835811415428
D3/0_respiratory electron transport chain (mitochondrion) (M231),outcome,34,-0.05957435390797758,0.737866997729175
D3/0_T cell differentiation (M14),outcome,34,-0.05934151761854488,0.7388557840432013
D1/0_complement and other receptors in DCs (M40),outcome,34,0.05927326974575225,0.7391456904448388
D3/0_B cell development (M9),outcome,34,-0.0582154358680453,0.7436436974050487
D3/0_cell adhesion (M51),outcome,34,0.05815776725497072,0.7438891507892742
D1/0_TBA (M151),outcome,34,0.058014329252554515,0.7444997695728629
D1/0_TBA (source: naive B cells) (M152.1),outcome,34,0.05755048332342541,0.7464754174866923
D7/0_TBA (M242),outcome,34,-0.05749549149470018,0.7467097483968361
D7/0_activated dendritic cells (M67),outcome,34,-0.05731302741349974,0.7474874230980109
D1/0_TBA (source: memory B cells) (M152.2),outcome,34,0.05676492654257688,0.7498249368275685
D7/0_TBA (M70.0),outcome,34,-0.056134988536185135,0.75251416912869
D1/0_enriched in NK cells (KIR cluster) (M61.1),outcome,34,-0.055361711598423756,0.7558192332792191
D7/0_cell junction (M162.1),outcome,34,-0.05533098269461402,0.7559506601104966
"D1/0_T & B cell development, activation (M62.0)",outcome,34,0.05478511355571926,0.758286447703776
D1/0_transmembrane transport (II) (M191),outcome,34,0.05461300077591922,0.7590233595079464
D3/0_metabolism of steroids (M225),outcome,34,-0.05453577323749556,0.7593540819079153
D1/0_TBA (M153),outcome,34,-0.05403725601536934,0.7614899588119889
D3/0_TBA (M190),outcome,34,0.05402327646245931,0.7615498786741302
D7/0_TBA (M185),outcome,34,0.05362455849428894,0.763259455635044
D3/0_enriched in DNA interacting proteins (M182),outcome,34,-0.05358928095107063,0.7634107677025911
D7/0_transcriptional targets of glucocorticoid receptor (M74),outcome,34,0.05249203355975571,0.7681213404788023
D1/0_platelet activation and degranulation (M85),outcome,34,0.05159013059433849,0.7719994075867842
D1/0_enriched in antigen presentation (III) (M95.1),outcome,34,-0.05157176376768635,0.7720784393161831
D7/0_integrin cell surface interactions (II) (M1.1),outcome,34,0.050890398152982304,0.7750119135966356
D1/0_erythrocyte differentiation (M173),outcome,34,-0.05036689676180693,0.7772678185408582
D1/0_mitotic cell cycle in stimulated CD4 T cells (M4.9),outcome,34,0.050255258564117014,0.7777491289567174
"D1/0_adhesion and migration, chemotaxis (M91)",outcome,34,-0.049576100907937064,0.7806789536169679
"D3/0_transcription elongation, RNA polymerase II (M234)",outcome,34,0.04954675178566214,0.7808056302518482
D7/0_ATF targets network (M41.4),outcome,34,0.049250723253480316,0.7820836573602632
D1/0_enriched in DNA interacting proteins (M182),outcome,34,0.04921880095579549,0.7822215072105396
D1/0_amino acid metabolishm and transport (M154.0),outcome,34,-0.048776491382048655,0.784132198396918
D1/0_T cell activation (III) (M7.4),outcome,34,-0.04855334009249565,0.7850966397627531
D7/0_respiratory electron transport chain (mitochondrion) (M231),outcome,34,0.04775884568477105,0.7885329206958567
D1/0_heme biosynthesis (II) (M222),outcome,34,-0.04721910940706314,0.7908695844053094
D7/0_T cell activation (IV) (M52),outcome,34,0.04713154249666115,0.7912488545290011
D3/0_double positive thymocytes (M126),outcome,34,0.046730380631422264,0.7929869687364324
D1/0_chemokine cluster (I) (M27.0),outcome,34,-0.0464843003456564,0.7940536463269822
D7/0_interferon alpha response (II) (M158.1),outcome,34,-0.0464803492919399,0.794070775850835
D1/0_purine nucleotide biosynthesis (M212),outcome,34,0.0463212445883619,0.7947606419445009
D3/0_cell cycle and growth arrest (M31),outcome,34,-0.046180439455332185,0.7953712899946132
D7/0_respiratory electron transport chain (mitochondrion) (M219),outcome,34,-0.0452880881130433,0.7992440285224839
D1/0_CD4 T cell surface signature Th1-stimulated (S6),outcome,34,0.045097495307308305,0.8000718002433727
D1/0_TBA (M186),outcome,34,-0.045041625639133887,0.8003144907564508
"D7/0_plasma cells, immunoglobulins (M156.1)",outcome,34,0.04503075088760228,0.8003617313864994
"D1/0_CCR1, 7 and cell signaling (M59)",outcome,34,-0.04465343583927453,0.802001242123079
D3/0_inositol phosphate metabolism (M129),outcome,34,0.044652802240298974,0.8020039959400558
D1/0_regulation of antigen presentation and immune response (M5.0),outcome,34,0.04464331653378666,0.8020452240323211
D1/0_golgi membrane (I) (M113),outcome,34,-0.04459531963705237,0.8022538428407855
D1/0_G protein coupled receptors cluster (M155),outcome,34,0.04390267167801947,0.805265929263068
D3/0_phosphatidylinositol signaling system (M101),outcome,34,-0.04380010369395212,0.8057121970820513
D1/0_mismatch repair (I) (M22.0),outcome,34,0.04375920812441233,0.8058901483324565
D3/0_mitotic cell cycle in stimulated CD4 T cells (M4.5),outcome,34,-0.043482979366380625,0.807092368718336
D3/0_T cell activation and signaling (M5.1),outcome,34,-0.04347621375625832,0.8071218198944894
D3/0_TBA (M203),outcome,34,0.043150154785539456,0.8085414854395827
"D7/0_adhesion and migration, chemotaxis (M91)",outcome,34,-0.042982149208069434,0.8092732188693011
D7/0_PLK1 signaling events (M4.2),outcome,34,0.04296785118343325,0.8093354999928066
D1/0_blood coagulation (M11.1),outcome,34,-0.04272805102110799,0.8103802226246519
D1/0_TBA (M214),outcome,34,0.04266315077055624,0.8106630249566585
D1/0_TBA (M180),outcome,34,0.042633849778927466,0.8107907115108907
D3/0_TBA (M105),outcome,34,-0.04258293746759558,0.8110125863101086
D3/0_TBA (M93),outcome,34,-0.042580620354051746,0.8110226845870715
D1/0_viral sensing & immunity; IRF2 targets network (II) (M111.1),outcome,34,0.04241914374526515,0.8117264939547109
D1/0_platelet activation (III) (M42),outcome,34,0.04241216688153678,0.8117569064708938
D3/0_mitotic cell cycle - DNA replication (M4.4),outcome,34,-0.04214465153571587,0.8129232235487835
"D7/0_Membrane, ER proteins (M134)",outcome,34,-0.0421100024083774,0.8130743162528311
D3/0_TBA (M72.0),outcome,34,0.041926140168256694,0.8138761857962864
D3/0_T cell surface signature (S0),outcome,34,0.04174855466963818,0.8146508572794975
D3/0_chemokine cluster (II) (M27.1),outcome,34,-0.04140988563056419,0.8161286925799477
D1/0_TBA (M72.0),outcome,34,0.04136493035963189,0.8163249088733743
D3/0_intracellular transport (M147),outcome,34,-0.040907895558557276,0.818320349341239
D1/0_activated dendritic cells (M67),outcome,34,-0.040527404372595714,0.8199824518727593
D7/0_golgi membrane (II) (M237),outcome,34,0.04051142346155195,0.8200522783128676
D1/0_Activated (LPS) dendritic cell surface signature (S11),outcome,34,-0.040051925390592324,0.8220605723296861
D3/0_C-MYC transcriptional network (M4.12),outcome,34,-0.03993168513841867,0.8225862813267719
D1/0_enriched in hepatocyte nuclear factors (II) (M88.2),outcome,34,0.03975786167607853,0.8233463984412224
D3/0_heme biosynthesis (II) (M222),outcome,34,-0.03975480211033411,0.8233597791110601
D7/0_enriched in membrane proteins (M124),outcome,34,-0.03975341854954958,0.8233658299760305
